Order_ID;Order_Date_Year;Order_Date_Month;Order_Date_Day;Order_Price_Total;Customer_Name;Customer_Country;Product_Name;Product_Category;Product_Order_Unit_Price;Product_Order_Quantity;Product_Order_Price_Total
11074;2009;9;10-9-2009;244.30;Simons bistro;Denmark;Pavlova;Confections;17.45;14;244.30
11075;2009;9;10-9-2009;586.00;Richter Supermarkt;Switzerland;Chang;Beverages;19.00;10;190.00
11075;2009;9;10-9-2009;586.00;Richter Supermarkt;Switzerland;Lakkalik��ri;Beverages;18.00;2;36.00
11075;2009;9;10-9-2009;586.00;Richter Supermarkt;Switzerland;Spegesild;Seafood;12.00;30;360.00
11076;2009;9;10-9-2009;1057.00;Bon app';France;Grandma's Boysenberry Spread;Condiments;25.00;20;500.00
11076;2009;9;10-9-2009;1057.00;Bon app';France;Teatime Chocolate Biscuits;Confections;9.20;10;92.00
11076;2009;9;10-9-2009;1057.00;Bon app';France;Tofu;Produce;23.25;20;465.00
11077;2009;9;10-9-2009;1374.60;Rattlesnake Canyon Grocery;USA;Chang;Beverages;19.00;24;456.00
11077;2009;9;10-9-2009;1374.60;Rattlesnake Canyon Grocery;USA;Chartreuse verte;Beverages;18.00;2;36.00
11077;2009;9;10-9-2009;1374.60;Rattlesnake Canyon Grocery;USA;Rh�nbr�u Klosterbier;Beverages;7.75;4;31.00
11077;2009;9;10-9-2009;1374.60;Rattlesnake Canyon Grocery;USA;Aniseed Syrup;Condiments;10.00;4;40.00
11077;2009;9;10-9-2009;1374.60;Rattlesnake Canyon Grocery;USA;Chef Anton's Cajun Seasoning;Condiments;22.00;1;22.00
11077;2009;9;10-9-2009;1374.60;Rattlesnake Canyon Grocery;USA;Grandma's Boysenberry Spread;Condiments;25.00;1;25.00
11077;2009;9;10-9-2009;1374.60;Rattlesnake Canyon Grocery;USA;Northwoods Cranberry Sauce;Condiments;40.00;2;80.00
11077;2009;9;10-9-2009;1374.60;Rattlesnake Canyon Grocery;USA;Louisiana Hot Spiced Okra;Condiments;17.00;1;17.00
11077;2009;9;10-9-2009;1374.60;Rattlesnake Canyon Grocery;USA;Original Frankfurter gr�ne So�e;Condiments;13.00;2;26.00
11077;2009;9;10-9-2009;1374.60;Rattlesnake Canyon Grocery;USA;Pavlova;Confections;17.45;2;34.90
11077;2009;9;10-9-2009;1374.60;Rattlesnake Canyon Grocery;USA;Sir Rodney's Marmalade;Confections;81.00;1;81.00
11077;2009;9;10-9-2009;1374.60;Rattlesnake Canyon Grocery;USA;Queso Manchego La Pastora;Dairy Products;38.00;2;76.00
11077;2009;9;10-9-2009;1374.60;Rattlesnake Canyon Grocery;USA;Mascarpone Fabioli;Dairy Products;32.00;1;32.00
11077;2009;9;10-9-2009;1374.60;Rattlesnake Canyon Grocery;USA;Camembert Pierrot;Dairy Products;34.00;2;68.00
11077;2009;9;10-9-2009;1374.60;Rattlesnake Canyon Grocery;USA;Tunnbr�d;Grains/Cereals;9.00;2;18.00
11077;2009;9;10-9-2009;1374.60;Rattlesnake Canyon Grocery;USA;Filo Mix;Grains/Cereals;7.00;2;14.00
11077;2009;9;10-9-2009;1374.60;Rattlesnake Canyon Grocery;USA;Wimmers gute Semmelkn�del;Grains/Cereals;33.25;2;66.50
11077;2009;9;10-9-2009;1374.60;Rattlesnake Canyon Grocery;USA;P�t� chinois;Meat/Poultry;24.00;2;48.00
11077;2009;9;10-9-2009;1374.60;Rattlesnake Canyon Grocery;USA;Uncle Bob's Organic Dried Pears;Produce;30.00;1;30.00
11077;2009;9;10-9-2009;1374.60;Rattlesnake Canyon Grocery;USA;Tofu;Produce;23.25;1;23.25
11077;2009;9;10-9-2009;1374.60;Rattlesnake Canyon Grocery;USA;Ikura;Seafood;31.00;1;31.00
11077;2009;9;10-9-2009;1374.60;Rattlesnake Canyon Grocery;USA;Konbu;Seafood;6.00;4;24.00
11077;2009;9;10-9-2009;1374.60;Rattlesnake Canyon Grocery;USA;Jack's New England Clam Chowder;Seafood;9.65;3;28.95
11077;2009;9;10-9-2009;1374.60;Rattlesnake Canyon Grocery;USA;Spegesild;Seafood;12.00;3;36.00
11077;2009;9;10-9-2009;1374.60;Rattlesnake Canyon Grocery;USA;R�d Kaviar;Seafood;15.00;2;30.00
11070;2009;9;9-9-2009;1873.50;Lehmanns Marktstand;Germany;Chai;Beverages;18.00;40;720.00
11070;2009;9;9-9-2009;1873.50;Lehmanns Marktstand;Germany;Chang;Beverages;19.00;20;380.00
11070;2009;9;9-9-2009;1873.50;Lehmanns Marktstand;Germany;Pavlova;Confections;17.45;30;523.50
11070;2009;9;9-9-2009;1873.50;Lehmanns Marktstand;Germany;Gorgonzola Telino;Dairy Products;12.50;20;250.00
11071;2009;9;9-9-2009;510.00;LILA-Supermercado;Venezuela;Uncle Bob's Organic Dried Pears;Produce;30.00;15;450.00
11071;2009;9;9-9-2009;510.00;LILA-Supermercado;Venezuela;Konbu;Seafood;6.00;10;60.00
11072;2009;9;9-9-2009;5218.00;Ernst Handel;Austria;Chang;Beverages;19.00;8;152.00
11072;2009;9;9-9-2009;5218.00;Ernst Handel;Austria;Valkoinen suklaa;Confections;16.25;22;357.50
11072;2009;9;9-9-2009;5218.00;Ernst Handel;Austria;Wimmers gute Semmelkn�del;Grains/Cereals;33.25;130;4322.50
11072;2009;9;9-9-2009;5218.00;Ernst Handel;Austria;Jack's New England Clam Chowder;Seafood;9.65;40;386.00
11073;2009;9;9-9-2009;300.00;Pericles Comidas cl�sicas;Mexico;Guaran� Fant�stica;Beverages;4.50;20;90.00
11073;2009;9;9-9-2009;300.00;Pericles Comidas cl�sicas;Mexico;Queso Cabrales;Dairy Products;21.00;10;210.00
11067;2009;9;8-9-2009;86.85;Drachenblut Delikatessen;Germany;Jack's New England Clam Chowder;Seafood;9.65;9;86.85
11068;2009;9;8-9-2009;2384.80;Queen Cozinha;Brazil;Ipoh Coffee;Beverages;46.00;36;1656.00
11068;2009;9;8-9-2009;2384.80;Queen Cozinha;Brazil;Original Frankfurter gr�ne So�e;Condiments;13.00;28;364.00
11068;2009;9;8-9-2009;2384.80;Queen Cozinha;Brazil;R�ssle Sauerkraut;Produce;45.60;8;364.80
11069;2009;9;8-9-2009;360.00;Tortuga Restaurante;Mexico;Chartreuse verte;Beverages;18.00;20;360.00
11064;2009;9;5-9-2009;4722.30;Save-a-lot Markets;USA;Scottish Longbreads;Confections;12.50;55;687.50
11064;2009;9;5-9-2009;4722.30;Save-a-lot Markets;USA;Alice Mutton;Meat/Poultry;39.00;77;3003.00
11064;2009;9;5-9-2009;4722.30;Save-a-lot Markets;USA;Perth Pasties;Meat/Poultry;32.80;25;820.00
11064;2009;9;5-9-2009;4722.30;Save-a-lot Markets;USA;P�t� chinois;Meat/Poultry;24.00;4;96.00
11064;2009;9;5-9-2009;4722.30;Save-a-lot Markets;USA;Jack's New England Clam Chowder;Seafood;9.65;12;115.80
11065;2009;9;5-9-2009;252.56;LILA-Supermercado;Venezuela;Tourti�re;Meat/Poultry;7.45;20;149.00
11065;2009;9;5-9-2009;252.56;LILA-Supermercado;Venezuela;Nord-Ost Matjeshering;Seafood;25.89;4;103.56
11066;2009;9;5-9-2009;928.75;White Clover Markets;USA;Sasquatch Ale;Beverages;14.00;35;490.00
11066;2009;9;5-9-2009;928.75;White Clover Markets;USA;Pavlova;Confections;17.45;3;52.35
11066;2009;9;5-9-2009;928.75;White Clover Markets;USA;Teatime Chocolate Biscuits;Confections;9.20;42;386.40
11060;2009;9;4-9-2009;266.00;Franchi SpA;Italy;Original Frankfurter gr�ne So�e;Condiments;13.00;10;130.00
11060;2009;9;4-9-2009;266.00;Franchi SpA;Italy;Camembert Pierrot;Dairy Products;34.00;4;136.00
11061;2009;9;4-9-2009;510.00;Great Lakes Food Market;USA;Camembert Pierrot;Dairy Products;34.00;15;510.00
11062;2009;9;4-9-2009;508.00;Reggiani Caseifici;Italy;Outback Lager;Beverages;15.00;12;180.00
11062;2009;9;4-9-2009;508.00;Reggiani Caseifici;Italy;Perth Pasties;Meat/Poultry;32.80;10;328.00
11063;2009;9;4-9-2009;1445.50;Hungry Owl All-Night Grocers;Ireland;Sasquatch Ale;Beverages;14.00;30;420.00
11063;2009;9;4-9-2009;1445.50;Hungry Owl All-Night Grocers;Ireland;Boston Crab Meat;Seafood;18.40;40;736.00
11063;2009;9;4-9-2009;1445.50;Hungry Owl All-Night Grocers;Ireland;Jack's New England Clam Chowder;Seafood;9.65;30;289.50
11057;2009;9;3-9-2009;45.00;North/South;UK;Outback Lager;Beverages;15.00;3;45.00
11058;2009;9;3-9-2009;858.00;Blauer See Delikatessen;Germany;Sirop d'�rable;Condiments;28.50;4;114.00
11058;2009;9;3-9-2009;858.00;Blauer See Delikatessen;Germany;Sir Rodney's Scones;Confections;10.00;3;30.00
11058;2009;9;3-9-2009;858.00;Blauer See Delikatessen;Germany;Camembert Pierrot;Dairy Products;34.00;21;714.00
11059;2009;9;3-9-2009;1838.00;Ricardo Adocicados;Brazil;Camembert Pierrot;Dairy Products;34.00;35;1190.00
11059;2009;9;3-9-2009;1838.00;Ricardo Adocicados;Brazil;Alice Mutton;Meat/Poultry;39.00;12;468.00
11059;2009;9;3-9-2009;1838.00;Ricardo Adocicados;Brazil;Konbu;Seafood;6.00;30;180.00
11054;2009;9;2-9-2009;305.00;Cactus Comidas para llevar;Argentina;Laughing Lumberjack Lager;Beverages;14.00;20;280.00
11054;2009;9;2-9-2009;305.00;Cactus Comidas para llevar;Argentina;Geitost;Dairy Products;2.50;10;25.00
11055;2009;9;2-9-2009;1727.50;HILARI�N-Abastos;Venezuela;Guaran� Fant�stica;Beverages;4.50;15;67.50
11055;2009;9;2-9-2009;1727.50;HILARI�N-Abastos;Venezuela;NuNuCa Nu�-Nougat-Creme;Confections;14.00;15;210.00
11055;2009;9;2-9-2009;1727.50;HILARI�N-Abastos;Venezuela;Ravioli Angelo;Grains/Cereals;19.50;20;390.00
11055;2009;9;2-9-2009;1727.50;HILARI�N-Abastos;Venezuela;Manjimup Dried Apples;Produce;53.00;20;1060.00
11056;2009;9;2-9-2009;3740.00;Eastern Connection;UK;Camembert Pierrot;Dairy Products;34.00;50;1700.00
11056;2009;9;2-9-2009;3740.00;Eastern Connection;UK;P�t� chinois;Meat/Poultry;24.00;35;840.00
11056;2009;9;2-9-2009;3740.00;Eastern Connection;UK;Uncle Bob's Organic Dried Pears;Produce;30.00;40;1200.00
11050;2009;9;1-9-2009;900.00;Folk och f� HB;Sweden;Lakkalik��ri;Beverages;18.00;50;900.00
11051;2009;9;1-9-2009;45.00;La maison d'Asie;France;Guaran� Fant�stica;Beverages;4.50;10;45.00
11052;2009;9;1-9-2009;1665.00;Hanari Carnes;Brazil;Ipoh Coffee;Beverages;46.00;30;1380.00
11052;2009;9;1-9-2009;1665.00;Hanari Carnes;Brazil;Sirop d'�rable;Condiments;28.50;10;285.00
11053;2009;9;1-9-2009;3658.75;Piccolo und mehr;Austria;Mascarpone Fabioli;Dairy Products;32.00;20;640.00
11053;2009;9;1-9-2009;3658.75;Piccolo und mehr;Austria;Wimmers gute Semmelkn�del;Grains/Cereals;33.25;25;831.25
11053;2009;9;1-9-2009;3658.75;Piccolo und mehr;Austria;Carnarvon Tigers;Seafood;62.50;35;2187.50
11047;2009;8;29-8-2009;1090.50;Eastern Connection;UK;Chai;Beverages;18.00;25;450.00
11047;2009;8;29-8-2009;1090.50;Eastern Connection;UK;Chef Anton's Gumbo Mix;Condiments;21.35;30;640.50
11048;2009;8;29-8-2009;525.00;Bottom-Dollar Markets;Canada;Scottish Longbreads;Confections;12.50;42;525.00
11049;2009;8;29-8-2009;342.00;Gourmet Lanchonetes;Brazil;Chang;Beverages;19.00;10;190.00
11049;2009;8;29-8-2009;342.00;Gourmet Lanchonetes;Brazil;Queso Manchego La Pastora;Dairy Products;38.00;4;152.00
11044;2009;8;28-8-2009;591.60;Wolski  Zajazd;Poland;Tarte au sucre;Confections;49.30;12;591.60
11045;2009;8;28-8-2009;1309.50;Bottom-Dollar Markets;Canada;Geitost;Dairy Products;2.50;15;37.50
11045;2009;8;28-8-2009;1309.50;Bottom-Dollar Markets;Canada;Manjimup Dried Apples;Produce;53.00;24;1272.00
11046;2009;8;28-8-2009;1564.00;Die Wandernde Kuh;Germany;Steeleye Stout;Beverages;18.00;18;324.00
11046;2009;8;28-8-2009;1564.00;Die Wandernde Kuh;Germany;Queso Manchego La Pastora;Dairy Products;38.00;20;760.00
11046;2009;8;28-8-2009;1564.00;Die Wandernde Kuh;Germany;Mascarpone Fabioli;Dairy Products;32.00;15;480.00
11040;2009;8;27-8-2009;200.00;Great Lakes Food Market;USA;Sir Rodney's Scones;Confections;10.00;20;200.00
11041;2009;8;27-8-2009;1887.00;Chop-suey Chinese;Switzerland;Chang;Beverages;19.00;30;570.00
11041;2009;8;27-8-2009;1887.00;Chop-suey Chinese;Switzerland;Vegie-spread;Condiments;43.90;30;1317.00
11042;2009;8;27-8-2009;405.75;Com�rcio Mineiro;Brazil;Gula Malacca;Condiments;19.45;15;291.75
11042;2009;8;27-8-2009;405.75;Com�rcio Mineiro;Brazil;Sirop d'�rable;Condiments;28.50;4;114.00
11043;2009;8;27-8-2009;210.00;Sp�cialit�s du monde;France;Queso Cabrales;Dairy Products;21.00;10;210.00
11037;2009;8;26-8-2009;60.00;Godos Cocina T�pica;Spain;Outback Lager;Beverages;15.00;4;60.00
11038;2009;8;26-8-2009;751.00;Supr�mes d�lices;Belgium;Fl�temysost;Dairy Products;21.50;30;645.00
11038;2009;8;26-8-2009;751.00;Supr�mes d�lices;Belgium;Filo Mix;Grains/Cereals;7.00;2;14.00
11038;2009;8;26-8-2009;751.00;Supr�mes d�lices;Belgium;Boston Crab Meat;Seafood;18.40;5;92.00
11039;2009;8;26-8-2009;3090.00;LINO-Delicateses;Venezuela;Steeleye Stout;Beverages;18.00;24;432.00
11039;2009;8;26-8-2009;3090.00;LINO-Delicateses;Venezuela;Maxilaku;Confections;20.00;60;1200.00
11039;2009;8;26-8-2009;3090.00;LINO-Delicateses;Venezuela;Ravioli Angelo;Grains/Cereals;19.50;28;546.00
11039;2009;8;26-8-2009;3090.00;LINO-Delicateses;Venezuela;R�ssle Sauerkraut;Produce;45.60;20;912.00
11034;2009;8;25-8-2009;554.40;Old World Delicatessen;USA;Gula Malacca;Condiments;19.45;12;233.40
11034;2009;8;25-8-2009;554.40;Old World Delicatessen;USA;Sirop d'�rable;Condiments;28.50;6;171.00
11034;2009;8;25-8-2009;554.40;Old World Delicatessen;USA;Sir Rodney's Scones;Confections;10.00;15;150.00
11035;2009;8;25-8-2009;1754.50;Supr�mes d�lices;Belgium;Chai;Beverages;18.00;10;180.00
11035;2009;8;25-8-2009;1754.50;Supr�mes d�lices;Belgium;Steeleye Stout;Beverages;18.00;60;1080.00
11035;2009;8;25-8-2009;1754.50;Supr�mes d�lices;Belgium;Singaporean Hokkien Fried Mee;Grains/Cereals;14.00;30;420.00
11035;2009;8;25-8-2009;1754.50;Supr�mes d�lices;Belgium;Tourti�re;Meat/Poultry;7.45;10;74.50
11036;2009;8;25-8-2009;1692.00;Drachenblut Delikatessen;Germany;Raclette Courdavault;Dairy Products;55.00;30;1650.00
11036;2009;8;25-8-2009;1692.00;Drachenblut Delikatessen;Germany;Konbu;Seafood;6.00;7;42.00
11030;2009;8;22-8-2009;16321.90;Save-a-lot Markets;USA;Chang;Beverages;19.00;100;1900.00
11030;2009;8;22-8-2009;16321.90;Save-a-lot Markets;USA;Chef Anton's Gumbo Mix;Condiments;21.35;70;1494.50
11030;2009;8;22-8-2009;16321.90;Save-a-lot Markets;USA;Raclette Courdavault;Dairy Products;55.00;100;5500.00
11030;2009;8;22-8-2009;16321.90;Save-a-lot Markets;USA;Th�ringer Rostbratwurst;Meat/Poultry;123.79;60;7427.40
11031;2009;8;22-8-2009;2393.50;Save-a-lot Markets;USA;Chai;Beverages;18.00;45;810.00
11031;2009;8;22-8-2009;2393.50;Save-a-lot Markets;USA;Guaran� Fant�stica;Beverages;4.50;21;94.50
11031;2009;8;22-8-2009;2393.50;Save-a-lot Markets;USA;Fl�temysost;Dairy Products;21.50;16;344.00
11031;2009;8;22-8-2009;2393.50;Save-a-lot Markets;USA;Wimmers gute Semmelkn�del;Grains/Cereals;33.25;20;665.00
11031;2009;8;22-8-2009;2393.50;Save-a-lot Markets;USA;Konbu;Seafood;6.00;80;480.00
11032;2009;8;22-8-2009;8902.50;White Clover Markets;USA;C�te de Blaye;Beverages;263.50;25;6587.50
11032;2009;8;22-8-2009;8902.50;White Clover Markets;USA;Raclette Courdavault;Dairy Products;55.00;30;1650.00
11032;2009;8;22-8-2009;8902.50;White Clover Markets;USA;Inlagd Sill;Seafood;19.00;35;665.00
11033;2009;8;22-8-2009;3592.00;Richter Supermarkt;Switzerland;Gudbrandsdalsost;Dairy Products;36.00;36;1296.00
11033;2009;8;22-8-2009;3592.00;Richter Supermarkt;Switzerland;Perth Pasties;Meat/Poultry;32.80;70;2296.00
11027;2009;8;21-8-2009;1170.30;Bottom-Dollar Markets;Canada;Guaran� Fant�stica;Beverages;4.50;30;135.00
11027;2009;8;21-8-2009;1170.30;Bottom-Dollar Markets;Canada;Tarte au sucre;Confections;49.30;21;1035.30
11028;2009;8;21-8-2009;2160.00;K�niglich Essen;Germany;Raclette Courdavault;Dairy Products;55.00;24;1320.00
11028;2009;8;21-8-2009;2160.00;K�niglich Essen;Germany;P�t� chinois;Meat/Poultry;24.00;35;840.00
11029;2009;8;21-8-2009;1286.80;Chop-suey Chinese;Switzerland;Vegie-spread;Condiments;43.90;12;526.80
11029;2009;8;21-8-2009;1286.80;Chop-suey Chinese;Switzerland;Gnocchi di nonna Alice;Grains/Cereals;38.00;20;760.00
11024;2009;8;20-8-2009;1966.81;Eastern Connection;UK;Louisiana Fiery Hot Pepper Sauce;Condiments;21.05;21;442.05
11024;2009;8;20-8-2009;1966.81;Eastern Connection;UK;Gumb�r Gummib�rchen;Confections;31.23;12;374.76
11024;2009;8;20-8-2009;1966.81;Eastern Connection;UK;Geitost;Dairy Products;2.50;30;75.00
11024;2009;8;20-8-2009;1966.81;Eastern Connection;UK;Fl�temysost;Dairy Products;21.50;50;1075.00
11025;2009;8;20-8-2009;300.00;Wartian Herkku;Finland;Chai;Beverages;18.00;10;180.00
11025;2009;8;20-8-2009;300.00;Wartian Herkku;Finland;Konbu;Seafood;6.00;20;120.00
11026;2009;8;20-8-2009;1030.00;Franchi SpA;Italy;Manjimup Dried Apples;Produce;53.00;10;530.00
11026;2009;8;20-8-2009;1030.00;Franchi SpA;Italy;Carnarvon Tigers;Seafood;62.50;8;500.00
11020;2009;8;19-8-2009;744.00;Ottilies K�seladen;Germany;Ikura;Seafood;31.00;24;744.00
11021;2009;8;19-8-2009;6941.49;QUICK-Stop;Germany;Chang;Beverages;19.00;11;209.00
11021;2009;8;19-8-2009;6941.49;QUICK-Stop;Germany;Sir Rodney's Marmalade;Confections;81.00;15;1215.00
11021;2009;8;19-8-2009;6941.49;QUICK-Stop;Germany;Gumb�r Gummib�rchen;Confections;31.23;63;1967.49
11021;2009;8;19-8-2009;6941.49;QUICK-Stop;Germany;Mozzarella di Giovanni;Dairy Products;34.80;35;1218.00
11021;2009;8;19-8-2009;6941.49;QUICK-Stop;Germany;Manjimup Dried Apples;Produce;53.00;44;2332.00
11022;2009;8;19-8-2009;1402.00;Hanari Carnes;Brazil;Teatime Chocolate Biscuits;Confections;9.20;35;322.00
11022;2009;8;19-8-2009;1402.00;Hanari Carnes;Brazil;Gudbrandsdalsost;Dairy Products;36.00;30;1080.00
11023;2009;8;19-8-2009;1500.00;B's Beverages;UK;Ipoh Coffee;Beverages;46.00;30;1380.00
11023;2009;8;19-8-2009;1500.00;B's Beverages;UK;Uncle Bob's Organic Dried Pears;Produce;30.00;4;120.00
11017;2009;8;18-8-2009;6750.00;Ernst Handel;Austria;Outback Lager;Beverages;15.00;30;450.00
11017;2009;8;18-8-2009;6750.00;Ernst Handel;Austria;Aniseed Syrup;Condiments;10.00;25;250.00
11017;2009;8;18-8-2009;6750.00;Ernst Handel;Austria;Raclette Courdavault;Dairy Products;55.00;110;6050.00
11018;2009;8;18-8-2009;1575.00;Lonesome Pine Restaurant;USA;Queso Manchego La Pastora;Dairy Products;38.00;20;760.00
11018;2009;8;18-8-2009;1575.00;Lonesome Pine Restaurant;USA;Gnocchi di nonna Alice;Grains/Cereals;38.00;5;190.00
11018;2009;8;18-8-2009;1575.00;Lonesome Pine Restaurant;USA;Carnarvon Tigers;Seafood;62.50;10;625.00
11019;2009;8;18-8-2009;76.00;Rancho grande;Argentina;Maxilaku;Confections;20.00;2;40.00
11019;2009;8;18-8-2009;76.00;Rancho grande;Argentina;Spegesild;Seafood;12.00;3;36.00
11014;2009;8;15-8-2009;270.20;LINO-Delicateses;Venezuela;Jack's New England Clam Chowder;Seafood;9.65;28;270.20
11015;2009;8;15-8-2009;622.35;Sant� Gourmet;Norway;Original Frankfurter gr�ne So�e;Condiments;13.00;18;234.00
11015;2009;8;15-8-2009;622.35;Sant� Gourmet;Norway;Nord-Ost Matjeshering;Seafood;25.89;15;388.35
11016;2009;8;15-8-2009;491.50;Around the Horn;UK;Gorgonzola Telino;Dairy Products;12.50;15;187.50
11016;2009;8;15-8-2009;491.50;Around the Horn;UK;Inlagd Sill;Seafood;19.00;16;304.00
11010;2009;8;14-8-2009;645.00;Reggiani Caseifici;Italy;Guaran� Fant�stica;Beverages;4.50;10;45.00
11010;2009;8;14-8-2009;645.00;Reggiani Caseifici;Italy;Uncle Bob's Organic Dried Pears;Produce;30.00;20;600.00
11011;2009;8;14-8-2009;960.00;Alfreds Futterkiste;Germany;Fl�temysost;Dairy Products;21.50;20;430.00
11011;2009;8;14-8-2009;960.00;Alfreds Futterkiste;Germany;Escargots de Bourgogne;Seafood;13.25;40;530.00
11012;2009;8;14-8-2009;2974.00;Frankenversand;Germany;Teatime Chocolate Biscuits;Confections;9.20;50;460.00
11012;2009;8;14-8-2009;2974.00;Frankenversand;Germany;Camembert Pierrot;Dairy Products;34.00;36;1224.00
11012;2009;8;14-8-2009;2974.00;Frankenversand;Germany;Fl�temysost;Dairy Products;21.50;60;1290.00
11013;2009;8;14-8-2009;361.00;Romero y tomillo;Spain;Scottish Longbreads;Confections;12.50;2;25.00
11013;2009;8;14-8-2009;361.00;Romero y tomillo;Spain;Tunnbr�d;Grains/Cereals;9.00;10;90.00
11013;2009;8;14-8-2009;361.00;Romero y tomillo;Spain;Singaporean Hokkien Fried Mee;Grains/Cereals;14.00;4;56.00
11013;2009;8;14-8-2009;361.00;Romero y tomillo;Spain;R�gede sild;Seafood;9.50;20;190.00
11007;2009;8;13-8-2009;2633.90;Princesa Isabel Vinhos;Portugal;Northwoods Cranberry Sauce;Condiments;40.00;30;1200.00
11007;2009;8;13-8-2009;2633.90;Princesa Isabel Vinhos;Portugal;Singaporean Hokkien Fried Mee;Grains/Cereals;14.00;14;196.00
11007;2009;8;13-8-2009;2633.90;Princesa Isabel Vinhos;Portugal;Th�ringer Rostbratwurst;Meat/Poultry;123.79;10;1237.90
11008;2009;8;13-8-2009;4903.50;Ernst Handel;Austria;Sasquatch Ale;Beverages;14.00;90;1260.00
11008;2009;8;13-8-2009;4903.50;Ernst Handel;Austria;Fl�temysost;Dairy Products;21.50;21;451.50
11008;2009;8;13-8-2009;4903.50;Ernst Handel;Austria;R�ssle Sauerkraut;Produce;45.60;70;3192.00
11009;2009;8;13-8-2009;702.00;Godos Cocina T�pica;Spain;Guaran� Fant�stica;Beverages;4.50;12;54.00
11009;2009;8;13-8-2009;702.00;Godos Cocina T�pica;Spain;Camembert Pierrot;Dairy Products;34.00;9;306.00
11009;2009;8;13-8-2009;702.00;Godos Cocina T�pica;Spain;Inlagd Sill;Seafood;19.00;18;342.00
11004;2009;8;12-8-2009;295.38;Maison Dewey;Belgium;Lakkalik��ri;Beverages;18.00;6;108.00
11004;2009;8;12-8-2009;295.38;Maison Dewey;Belgium;Gumb�r Gummib�rchen;Confections;31.23;6;187.38
11005;2009;8;12-8-2009;586.00;Wilman Kala;Finland;Chai;Beverages;18.00;2;36.00
11005;2009;8;12-8-2009;586.00;Wilman Kala;Finland;Raclette Courdavault;Dairy Products;55.00;10;550.00
11006;2009;8;12-8-2009;391.58;Great Lakes Food Market;USA;Chai;Beverages;18.00;8;144.00
11006;2009;8;12-8-2009;391.58;Great Lakes Food Market;USA;Th�ringer Rostbratwurst;Meat/Poultry;123.79;2;247.58
11000;2009;8;11-8-2009;1075.00;Rattlesnake Canyon Grocery;USA;Guaran� Fant�stica;Beverages;4.50;30;135.00
11000;2009;8;11-8-2009;1075.00;Rattlesnake Canyon Grocery;USA;Chef Anton's Cajun Seasoning;Condiments;22.00;25;550.00
11000;2009;8;11-8-2009;1075.00;Rattlesnake Canyon Grocery;USA;Original Frankfurter gr�ne So�e;Condiments;13.00;30;390.00
11001;2009;8;11-8-2009;2769.00;Folk och f� HB;Sweden;Gustaf's Kn�ckebr�d;Grains/Cereals;21.00;25;525.00
11001;2009;8;11-8-2009;2769.00;Folk och f� HB;Sweden;P�t� chinois;Meat/Poultry;24.00;6;144.00
11001;2009;8;11-8-2009;2769.00;Folk och f� HB;Sweden;Uncle Bob's Organic Dried Pears;Produce;30.00;60;1800.00
11001;2009;8;11-8-2009;2769.00;Folk och f� HB;Sweden;Spegesild;Seafood;12.00;25;300.00
11002;2009;8;11-8-2009;1902.00;Save-a-lot Markets;USA;Steeleye Stout;Beverages;18.00;15;270.00
11002;2009;8;11-8-2009;1902.00;Save-a-lot Markets;USA;Singaporean Hokkien Fried Mee;Grains/Cereals;14.00;24;336.00
11002;2009;8;11-8-2009;1902.00;Save-a-lot Markets;USA;P�t� chinois;Meat/Poultry;24.00;40;960.00
11002;2009;8;11-8-2009;1902.00;Save-a-lot Markets;USA;Konbu;Seafood;6.00;56;336.00
11003;2009;8;11-8-2009;326.00;The Cracker Box;USA;Chai;Beverages;18.00;4;72.00
11003;2009;8;11-8-2009;326.00;The Cracker Box;USA;Filo Mix;Grains/Cereals;7.00;10;70.00
11003;2009;8;11-8-2009;326.00;The Cracker Box;USA;Boston Crab Meat;Seafood;18.40;10;184.00
10997;2009;8;8-8-2009;1980.00;LILA-Supermercado;Venezuela;Mascarpone Fabioli;Dairy Products;32.00;50;1600.00
10997;2009;8;8-8-2009;1980.00;LILA-Supermercado;Venezuela;Filo Mix;Grains/Cereals;7.00;20;140.00
10997;2009;8;8-8-2009;1980.00;LILA-Supermercado;Venezuela;Spegesild;Seafood;12.00;20;240.00
10998;2009;8;8-8-2009;686.00;Wolski  Zajazd;Poland;Guaran� Fant�stica;Beverages;4.50;12;54.00
10998;2009;8;8-8-2009;686.00;Wolski  Zajazd;Poland;Rh�nbr�u Klosterbier;Beverages;7.75;30;232.50
10998;2009;8;8-8-2009;686.00;Wolski  Zajazd;Poland;Sirop d'�rable;Condiments;28.50;7;199.50
10998;2009;8;8-8-2009;686.00;Wolski  Zajazd;Poland;Longlife Tofu;Produce;10.00;20;200.00
10999;2009;8;8-8-2009;1261.00;Ottilies K�seladen;Germany;Original Frankfurter gr�ne So�e;Condiments;13.00;21;273.00
10999;2009;8;8-8-2009;1261.00;Ottilies K�seladen;Germany;Manjimup Dried Apples;Produce;53.00;15;795.00
10999;2009;8;8-8-2009;1261.00;Ottilies K�seladen;Germany;Jack's New England Clam Chowder;Seafood;9.65;20;193.00
10994;2009;8;7-8-2009;990.00;Vaffeljernet;Denmark;Raclette Courdavault;Dairy Products;55.00;18;990.00
10995;2009;8;7-8-2009;1196.00;Pericles Comidas cl�sicas;Mexico;Camembert Pierrot;Dairy Products;34.00;4;136.00
10995;2009;8;7-8-2009;1196.00;Pericles Comidas cl�sicas;Mexico;Manjimup Dried Apples;Produce;53.00;20;1060.00
10996;2009;8;7-8-2009;560.00;QUICK-Stop;Germany;Singaporean Hokkien Fried Mee;Grains/Cereals;14.00;40;560.00
10990;2009;8;6-8-2009;4931.00;Ernst Handel;Austria;Sasquatch Ale;Beverages;14.00;60;840.00
10990;2009;8;6-8-2009;4931.00;Ernst Handel;Austria;Sirop d'�rable;Condiments;28.50;66;1881.00
10990;2009;8;6-8-2009;4931.00;Ernst Handel;Austria;Sir Rodney's Scones;Confections;10.00;65;650.00
10990;2009;8;6-8-2009;4931.00;Ernst Handel;Austria;P�t� chinois;Meat/Poultry;24.00;65;1560.00
10991;2009;8;6-8-2009;2870.00;QUICK-Stop;Germany;Chang;Beverages;19.00;50;950.00
10991;2009;8;6-8-2009;2870.00;QUICK-Stop;Germany;Outback Lager;Beverages;15.00;20;300.00
10991;2009;8;6-8-2009;2870.00;QUICK-Stop;Germany;Lakkalik��ri;Beverages;18.00;90;1620.00
10992;2009;8;6-8-2009;69.60;The Big Cheese;USA;Mozzarella di Giovanni;Dairy Products;34.80;2;69.60
10993;2009;8;6-8-2009;6527.25;Folk och f� HB;Sweden;Th�ringer Rostbratwurst;Meat/Poultry;123.79;50;6189.50
10993;2009;8;6-8-2009;6527.25;Folk och f� HB;Sweden;Jack's New England Clam Chowder;Seafood;9.65;35;337.75
10987;2009;8;5-8-2009;2772.00;Eastern Connection;UK;Ipoh Coffee;Beverages;46.00;6;276.00
10987;2009;8;5-8-2009;2772.00;Eastern Connection;UK;Mozzarella di Giovanni;Dairy Products;34.80;20;696.00
10987;2009;8;5-8-2009;2772.00;Eastern Connection;UK;Uncle Bob's Organic Dried Pears;Produce;30.00;60;1800.00
10988;2009;8;5-8-2009;3772.00;Rattlesnake Canyon Grocery;USA;Tarte au sucre;Confections;49.30;40;1972.00
10988;2009;8;5-8-2009;3772.00;Rattlesnake Canyon Grocery;USA;Uncle Bob's Organic Dried Pears;Produce;30.00;60;1800.00
10989;2009;8;5-8-2009;1353.60;Que Del�cia;Brazil;Grandma's Boysenberry Spread;Condiments;25.00;40;1000.00
10989;2009;8;5-8-2009;1353.60;Que Del�cia;Brazil;Queso Cabrales;Dairy Products;21.00;15;315.00
10989;2009;8;5-8-2009;1353.60;Que Del�cia;Brazil;Jack's New England Clam Chowder;Seafood;9.65;4;38.60
10984;2009;8;4-8-2009;1809.75;Save-a-lot Markets;USA;Guaran� Fant�stica;Beverages;4.50;20;90.00
10984;2009;8;4-8-2009;1809.75;Save-a-lot Markets;USA;Pavlova;Confections;17.45;55;959.75
10984;2009;8;4-8-2009;1809.75;Save-a-lot Markets;USA;Inlagd Sill;Seafood;19.00;40;760.00
10985;2009;8;4-8-2009;2248.20;Hungry Owl All-Night Grocers;Ireland;Pavlova;Confections;17.45;36;628.20
10985;2009;8;4-8-2009;2248.20;Hungry Owl All-Night Grocers;Ireland;Mascarpone Fabioli;Dairy Products;32.00;35;1120.00
10985;2009;8;4-8-2009;2248.20;Hungry Owl All-Night Grocers;Ireland;Carnarvon Tigers;Seafood;62.50;8;500.00
10986;2009;8;4-8-2009;2220.00;Oc�ano Atl�ntico Ltda;Argentina;Lakkalik��ri;Beverages;18.00;10;180.00
10986;2009;8;4-8-2009;2220.00;Oc�ano Atl�ntico Ltda;Argentina;Original Frankfurter gr�ne So�e;Condiments;13.00;15;195.00
10986;2009;8;4-8-2009;2220.00;Oc�ano Atl�ntico Ltda;Argentina;Sir Rodney's Marmalade;Confections;81.00;15;1215.00
10986;2009;8;4-8-2009;2220.00;Oc�ano Atl�ntico Ltda;Argentina;Queso Cabrales;Dairy Products;21.00;30;630.00
10980;2009;8;1-8-2009;310.00;Folk och f� HB;Sweden;Rh�nbr�u Klosterbier;Beverages;7.75;40;310.00
10981;2009;8;1-8-2009;15810.00;Hanari Carnes;Brazil;C�te de Blaye;Beverages;263.50;60;15810.00
10982;2009;8;1-8-2009;1014.00;Bottom-Dollar Markets;Canada;Ipoh Coffee;Beverages;46.00;9;414.00
10982;2009;8;1-8-2009;1014.00;Bottom-Dollar Markets;Canada;Uncle Bob's Organic Dried Pears;Produce;30.00;20;600.00
10983;2009;8;1-8-2009;796.50;Save-a-lot Markets;USA;Ravioli Angelo;Grains/Cereals;19.50;15;292.50
10983;2009;8;1-8-2009;796.50;Save-a-lot Markets;USA;Konbu;Seafood;6.00;84;504.00
10977;2009;7;31-7-2009;2233.00;Folk och f� HB;Sweden;Chartreuse verte;Beverages;18.00;30;540.00
10977;2009;7;31-7-2009;2233.00;Folk och f� HB;Sweden;Vegie-spread;Condiments;43.90;20;878.00
10977;2009;7;31-7-2009;2233.00;Folk och f� HB;Sweden;Zaanse koeken;Confections;9.50;30;285.00
10977;2009;7;31-7-2009;2233.00;Folk och f� HB;Sweden;Manjimup Dried Apples;Produce;53.00;10;530.00
10978;2009;7;31-7-2009;1500.70;Maison Dewey;Belgium;Northwoods Cranberry Sauce;Condiments;40.00;20;800.00
10978;2009;7;31-7-2009;1500.70;Maison Dewey;Belgium;Gula Malacca;Condiments;19.45;6;116.70
10978;2009;7;31-7-2009;1500.70;Maison Dewey;Belgium;Sir Rodney's Scones;Confections;10.00;40;400.00
10978;2009;7;31-7-2009;1500.70;Maison Dewey;Belgium;Boston Crab Meat;Seafood;18.40;10;184.00
10979;2009;7;31-7-2009;4813.50;Ernst Handel;Austria;Guaran� Fant�stica;Beverages;4.50;80;360.00
10979;2009;7;31-7-2009;4813.50;Ernst Handel;Austria;Vegie-spread;Condiments;43.90;35;1536.50
10979;2009;7;31-7-2009;4813.50;Ernst Handel;Austria;Schoggi Schokolade;Confections;43.90;30;1317.00
10979;2009;7;31-7-2009;4813.50;Ernst Handel;Austria;Queso Manchego La Pastora;Dairy Products;38.00;20;760.00
10979;2009;7;31-7-2009;4813.50;Ernst Handel;Austria;Gorgonzola Telino;Dairy Products;12.50;24;300.00
10979;2009;7;31-7-2009;4813.50;Ernst Handel;Austria;Uncle Bob's Organic Dried Pears;Produce;30.00;18;540.00
10974;2009;7;30-7-2009;439.00;Split Rail Beer & Ale;USA;Vegie-spread;Condiments;43.90;10;439.00
10975;2009;7;30-7-2009;717.50;Bottom-Dollar Markets;Canada;Rh�nbr�u Klosterbier;Beverages;7.75;10;77.50
10975;2009;7;30-7-2009;717.50;Bottom-Dollar Markets;Canada;Northwoods Cranberry Sauce;Condiments;40.00;16;640.00
10976;2009;7;30-7-2009;912.00;HILARI�N-Abastos;Venezuela;R�ssle Sauerkraut;Produce;45.60;20;912.00
10970;2009;7;29-7-2009;280.00;B�lido Comidas preparadas;Spain;Filo Mix;Grains/Cereals;7.00;40;280.00
10971;2009;7;29-7-2009;1733.06;France restauration;France;Th�ringer Rostbratwurst;Meat/Poultry;123.79;14;1733.06
10972;2009;7;29-7-2009;251.50;La corne d'abondance;France;Geitost;Dairy Products;2.50;7;17.50
10972;2009;7;29-7-2009;251.50;La corne d'abondance;France;Alice Mutton;Meat/Poultry;39.00;6;234.00
10973;2009;7;29-7-2009;291.55;La corne d'abondance;France;Rh�nbr�u Klosterbier;Beverages;7.75;10;77.50
10973;2009;7;29-7-2009;291.55;La corne d'abondance;France;Gumb�r Gummib�rchen;Confections;31.23;5;156.15
10973;2009;7;29-7-2009;291.55;La corne d'abondance;France;Jack's New England Clam Chowder;Seafood;9.65;6;57.90
10967;2009;7;28-7-2009;910.40;Toms Spezialit�ten;Germany;Teatime Chocolate Biscuits;Confections;9.20;12;110.40
10967;2009;7;28-7-2009;910.40;Toms Spezialit�ten;Germany;Maxilaku;Confections;20.00;40;800.00
10968;2009;7;28-7-2009;1408.00;Ernst Handel;Austria;Guaran� Fant�stica;Beverages;4.50;30;135.00
10968;2009;7;28-7-2009;1408.00;Ernst Handel;Austria;Queso Manchego La Pastora;Dairy Products;38.00;30;1140.00
10968;2009;7;28-7-2009;1408.00;Ernst Handel;Austria;Wimmers gute Semmelkn�del;Grains/Cereals;33.25;4;133.00
10969;2009;7;28-7-2009;108.00;Com�rcio Mineiro;Brazil;Spegesild;Seafood;12.00;9;108.00
10964;2009;7;25-7-2009;2052.50;Sp�cialit�s du monde;France;C�te de Blaye;Beverages;263.50;5;1317.50
10964;2009;7;25-7-2009;2052.50;Sp�cialit�s du monde;France;Gudbrandsdalsost;Dairy Products;36.00;10;360.00
10964;2009;7;25-7-2009;2052.50;Sp�cialit�s du monde;France;Carnarvon Tigers;Seafood;62.50;6;375.00
10965;2009;7;25-7-2009;848.00;Old World Delicatessen;USA;Manjimup Dried Apples;Produce;53.00;16;848.00
10966;2009;7;25-7-2009;1255.60;Chop-suey Chinese;Switzerland;Tarte au sucre;Confections;49.30;12;591.60
10966;2009;7;25-7-2009;1255.60;Chop-suey Chinese;Switzerland;Gnocchi di nonna Alice;Grains/Cereals;38.00;12;456.00
10966;2009;7;25-7-2009;1255.60;Chop-suey Chinese;Switzerland;Gravad lax;Seafood;26.00;8;208.00
10960;2009;7;24-7-2009;276.60;HILARI�N-Abastos;Venezuela;Guaran� Fant�stica;Beverages;4.50;10;45.00
10960;2009;7;24-7-2009;276.60;HILARI�N-Abastos;Venezuela;Jack's New England Clam Chowder;Seafood;9.65;24;231.60
10961;2009;7;24-7-2009;1122.00;Queen Cozinha;Brazil;Lakkalik��ri;Beverages;18.00;60;1080.00
10961;2009;7;24-7-2009;1122.00;Queen Cozinha;Brazil;Filo Mix;Grains/Cereals;7.00;6;42.00
10962;2009;7;24-7-2009;3584.00;QUICK-Stop;Germany;Lakkalik��ri;Beverages;18.00;44;792.00
10962;2009;7;24-7-2009;3584.00;QUICK-Stop;Germany;Gudbrandsdalsost;Dairy Products;36.00;9;324.00
10962;2009;7;24-7-2009;3584.00;QUICK-Stop;Germany;Perth Pasties;Meat/Poultry;32.80;20;656.00
10962;2009;7;24-7-2009;3584.00;QUICK-Stop;Germany;Uncle Bob's Organic Dried Pears;Produce;30.00;45;1350.00
10962;2009;7;24-7-2009;3584.00;QUICK-Stop;Germany;Konbu;Seafood;6.00;77;462.00
10963;2009;7;24-7-2009;68.00;Furia Bacalhau e Frutos do Mar;Portugal;Camembert Pierrot;Dairy Products;34.00;2;68.00
10957;2009;7;23-7-2009;1762.70;HILARI�N-Abastos;Venezuela;Steeleye Stout;Beverages;18.00;40;720.00
10957;2009;7;23-7-2009;1762.70;HILARI�N-Abastos;Venezuela;Wimmers gute Semmelkn�del;Grains/Cereals;33.25;8;266.00
10957;2009;7;23-7-2009;1762.70;HILARI�N-Abastos;Venezuela;Nord-Ost Matjeshering;Seafood;25.89;30;776.70
10958;2009;7;23-7-2009;781.00;Oc�ano Atl�ntico Ltda;Argentina;Chef Anton's Gumbo Mix;Condiments;21.35;20;427.00
10958;2009;7;23-7-2009;781.00;Oc�ano Atl�ntico Ltda;Argentina;Mozzarella di Giovanni;Dairy Products;34.80;5;174.00
10958;2009;7;23-7-2009;781.00;Oc�ano Atl�ntico Ltda;Argentina;Uncle Bob's Organic Dried Pears;Produce;30.00;6;180.00
10959;2009;7;23-7-2009;155.00;Gourmet Lanchonetes;Brazil;Rh�nbr�u Klosterbier;Beverages;7.75;20;155.00
10954;2009;7;22-7-2009;1902.10;LINO-Delicateses;Venezuela;Pavlova;Confections;17.45;28;488.60
10954;2009;7;22-7-2009;1902.10;LINO-Delicateses;Venezuela;Gorgonzola Telino;Dairy Products;12.50;25;312.50
10954;2009;7;22-7-2009;1902.10;LINO-Delicateses;Venezuela;Camembert Pierrot;Dairy Products;34.00;24;816.00
10954;2009;7;22-7-2009;1902.10;LINO-Delicateses;Venezuela;R�gede sild;Seafood;9.50;30;285.00
10955;2009;7;22-7-2009;93.00;Folk och f� HB;Sweden;Rh�nbr�u Klosterbier;Beverages;7.75;12;93.00
10956;2009;7;22-7-2009;677.00;Blauer See Delikatessen;Germany;Sir Rodney's Scones;Confections;10.00;12;120.00
10956;2009;7;22-7-2009;677.00;Blauer See Delikatessen;Germany;Zaanse koeken;Confections;9.50;14;133.00
10956;2009;7;22-7-2009;677.00;Blauer See Delikatessen;Germany;Manjimup Dried Apples;Produce;53.00;8;424.00
10950;2009;7;21-7-2009;110.00;Magazzini Alimentari Riuniti;Italy;Chef Anton's Cajun Seasoning;Condiments;22.00;5;110.00
10951;2009;7;21-7-2009;482.90;Richter Supermarkt;Switzerland;Rh�nbr�u Klosterbier;Beverages;7.75;50;387.50
10951;2009;7;21-7-2009;482.90;Richter Supermarkt;Switzerland;Geitost;Dairy Products;2.50;15;37.50
10951;2009;7;21-7-2009;482.90;Richter Supermarkt;Switzerland;Jack's New England Clam Chowder;Seafood;9.65;6;57.90
10952;2009;7;21-7-2009;491.20;Alfreds Futterkiste;Germany;Grandma's Boysenberry Spread;Condiments;25.00;16;400.00
10952;2009;7;21-7-2009;491.20;Alfreds Futterkiste;Germany;R�ssle Sauerkraut;Produce;45.60;2;91.20
10953;2009;7;21-7-2009;4675.00;Around the Horn;UK;Sir Rodney's Marmalade;Confections;81.00;50;4050.00
10953;2009;7;21-7-2009;4675.00;Around the Horn;UK;Gorgonzola Telino;Dairy Products;12.50;50;625.00
10947;2009;7;18-7-2009;220.00;B's Beverages;UK;Raclette Courdavault;Dairy Products;55.00;4;220.00
10948;2009;7;18-7-2009;2362.25;Godos Cocina T�pica;Spain;Valkoinen suklaa;Confections;16.25;9;146.25
10948;2009;7;18-7-2009;2362.25;Godos Cocina T�pica;Spain;P�t� chinois;Meat/Poultry;24.00;4;96.00
10948;2009;7;18-7-2009;2362.25;Godos Cocina T�pica;Spain;Manjimup Dried Apples;Produce;53.00;40;2120.00
10949;2009;7;18-7-2009;4422.00;Bottom-Dollar Markets;Canada;Grandma's Boysenberry Spread;Condiments;25.00;12;300.00
10949;2009;7;18-7-2009;4422.00;Bottom-Dollar Markets;Canada;Tarte au sucre;Confections;49.30;60;2958.00
10949;2009;7;18-7-2009;4422.00;Bottom-Dollar Markets;Canada;Alice Mutton;Meat/Poultry;39.00;6;234.00
10949;2009;7;18-7-2009;4422.00;Bottom-Dollar Markets;Canada;Ikura;Seafood;31.00;30;930.00
10944;2009;7;17-7-2009;1139.10;Bottom-Dollar Markets;Canada;Gula Malacca;Condiments;19.45;18;350.10
10944;2009;7;17-7-2009;1139.10;Bottom-Dollar Markets;Canada;Queso Cabrales;Dairy Products;21.00;5;105.00
10944;2009;7;17-7-2009;1139.10;Bottom-Dollar Markets;Canada;Gnocchi di nonna Alice;Grains/Cereals;38.00;18;684.00
10945;2009;7;17-7-2009;245.00;Morgenstern Gesundkost;Germany;Gorgonzola Telino;Dairy Products;12.50;10;125.00
10945;2009;7;17-7-2009;245.00;Morgenstern Gesundkost;Germany;Konbu;Seafood;6.00;20;120.00
10946;2009;7;17-7-2009;1407.50;Vaffeljernet;Denmark;Guaran� Fant�stica;Beverages;4.50;25;112.50
10946;2009;7;17-7-2009;1407.50;Vaffeljernet;Denmark;Original Frankfurter gr�ne So�e;Condiments;13.00;40;520.00
10946;2009;7;17-7-2009;1407.50;Vaffeljernet;Denmark;Ikura;Seafood;31.00;25;775.00
10940;2009;7;16-7-2009;360.00;Bon app';France;Uncle Bob's Organic Dried Pears;Produce;30.00;8;240.00
10940;2009;7;16-7-2009;360.00;Bon app';France;Konbu;Seafood;6.00;20;120.00
10941;2009;7;16-7-2009;4769.00;Save-a-lot Markets;USA;Tarte au sucre;Confections;49.30;30;1479.00
10941;2009;7;16-7-2009;4769.00;Save-a-lot Markets;USA;Scottish Longbreads;Confections;12.50;80;1000.00
10941;2009;7;16-7-2009;4769.00;Save-a-lot Markets;USA;Gorgonzola Telino;Dairy Products;12.50;44;550.00
10941;2009;7;16-7-2009;4769.00;Save-a-lot Markets;USA;Mozzarella di Giovanni;Dairy Products;34.80;50;1740.00
10942;2009;7;16-7-2009;560.00;Reggiani Caseifici;Italy;Maxilaku;Confections;20.00;28;560.00
10943;2009;7;16-7-2009;711.00;B's Beverages;UK;Gustaf's Kn�ckebr�d;Grains/Cereals;21.00;21;441.00
10943;2009;7;16-7-2009;711.00;B's Beverages;UK;Konbu;Seafood;6.00;15;90.00
10943;2009;7;16-7-2009;711.00;B's Beverages;UK;Spegesild;Seafood;12.00;15;180.00
10937;2009;7;15-7-2009;644.80;Cactus Comidas para llevar;Argentina;Sasquatch Ale;Beverages;14.00;20;280.00
10937;2009;7;15-7-2009;644.80;Cactus Comidas para llevar;Argentina;R�ssle Sauerkraut;Produce;45.60;8;364.80
10938;2009;7;15-7-2009;3642.50;QUICK-Stop;Germany;Ipoh Coffee;Beverages;46.00;24;1104.00
10938;2009;7;15-7-2009;3642.50;QUICK-Stop;Germany;Camembert Pierrot;Dairy Products;34.00;49;1666.00
10938;2009;7;15-7-2009;3642.50;QUICK-Stop;Germany;Fl�temysost;Dairy Products;21.50;35;752.50
10938;2009;7;15-7-2009;3642.50;QUICK-Stop;Germany;Konbu;Seafood;6.00;20;120.00
10939;2009;7;15-7-2009;750.00;Magazzini Alimentari Riuniti;Italy;Chang;Beverages;19.00;10;190.00
10939;2009;7;15-7-2009;750.00;Magazzini Alimentari Riuniti;Italy;Laughing Lumberjack Lager;Beverages;14.00;40;560.00
10934;2009;7;14-7-2009;500.00;Lehmanns Marktstand;Germany;Grandma's Boysenberry Spread;Condiments;25.00;20;500.00
10935;2009;7;14-7-2009;700.00;Wellington Importadora;Brazil;Chai;Beverages;18.00;21;378.00
10935;2009;7;14-7-2009;700.00;Wellington Importadora;Brazil;Tunnbr�d;Grains/Cereals;9.00;8;72.00
10935;2009;7;14-7-2009;700.00;Wellington Importadora;Brazil;Carnarvon Tigers;Seafood;62.50;4;250.00
10936;2009;7;14-7-2009;570.00;Great Lakes Food Market;USA;Inlagd Sill;Seafood;19.00;30;570.00
10930;2009;7;11-7-2009;2455.00;Supr�mes d�lices;Belgium;Sir Rodney's Scones;Confections;10.00;36;360.00
10930;2009;7;11-7-2009;2455.00;Supr�mes d�lices;Belgium;Schoggi Schokolade;Confections;43.90;25;1097.50
10930;2009;7;11-7-2009;2455.00;Supr�mes d�lices;Belgium;P�t� chinois;Meat/Poultry;24.00;25;600.00
10930;2009;7;11-7-2009;2455.00;Supr�mes d�lices;Belgium;Escargots de Bourgogne;Seafood;13.25;30;397.50
10931;2009;7;11-7-2009;837.00;Richter Supermarkt;Switzerland;Ravioli Angelo;Grains/Cereals;19.50;30;585.00
10931;2009;7;11-7-2009;837.00;Richter Supermarkt;Switzerland;Konbu;Seafood;6.00;42;252.00
10932;2009;7;11-7-2009;1925.50;Bon app';France;Rh�nbr�u Klosterbier;Beverages;7.75;20;155.00
10932;2009;7;11-7-2009;1925.50;Bon app';France;Pavlova;Confections;17.45;30;523.50
10932;2009;7;11-7-2009;1925.50;Bon app';France;Tarte au sucre;Confections;49.30;14;690.20
10932;2009;7;11-7-2009;1925.50;Bon app';France;Mozzarella di Giovanni;Dairy Products;34.80;16;556.80
10933;2009;7;11-7-2009;920.60;Island Trading;UK;Sirop d'�rable;Condiments;28.50;30;855.00
10933;2009;7;11-7-2009;920.60;Island Trading;UK;Perth Pasties;Meat/Poultry;32.80;2;65.60
10927;2009;7;10-7-2009;800.00;La corne d'abondance;France;Lakkalik��ri;Beverages;18.00;20;360.00
10927;2009;7;10-7-2009;800.00;La corne d'abondance;France;Sir Rodney's Marmalade;Confections;81.00;5;405.00
10927;2009;7;10-7-2009;800.00;La corne d'abondance;France;Filo Mix;Grains/Cereals;7.00;5;35.00
10928;2009;7;10-7-2009;137.50;Galer�a del gastr�nomo;Spain;Lakkalik��ri;Beverages;18.00;5;90.00
10928;2009;7;10-7-2009;137.50;Galer�a del gastr�nomo;Spain;Zaanse koeken;Confections;9.50;5;47.50
10929;2009;7;10-7-2009;1174.75;Frankenversand;Germany;Rh�nbr�u Klosterbier;Beverages;7.75;49;379.75
10929;2009;7;10-7-2009;1174.75;Frankenversand;Germany;Original Frankfurter gr�ne So�e;Condiments;13.00;15;195.00
10929;2009;7;10-7-2009;1174.75;Frankenversand;Germany;Sir Rodney's Scones;Confections;10.00;60;600.00
10924;2009;7;9-7-2009;2034.50;Berglunds snabbk�p;Sweden;Rh�nbr�u Klosterbier;Beverages;7.75;6;46.50
10924;2009;7;9-7-2009;2034.50;Berglunds snabbk�p;Sweden;R�ssle Sauerkraut;Produce;45.60;30;1368.00
10924;2009;7;9-7-2009;2034.50;Berglunds snabbk�p;Sweden;Ikura;Seafood;31.00;20;620.00
10925;2009;7;9-7-2009;559.00;Hanari Carnes;Brazil;Filo Mix;Grains/Cereals;7.00;12;84.00
10925;2009;7;9-7-2009;559.00;Hanari Carnes;Brazil;Inlagd Sill;Seafood;19.00;25;475.00
10926;2009;7;9-7-2009;514.40;Ana Trujillo Emparedados y helados;Mexico;Teatime Chocolate Biscuits;Confections;9.20;7;64.40
10926;2009;7;9-7-2009;514.40;Ana Trujillo Emparedados y helados;Mexico;Queso Cabrales;Dairy Products;21.00;2;42.00
10926;2009;7;9-7-2009;514.40;Ana Trujillo Emparedados y helados;Mexico;Mozzarella di Giovanni;Dairy Products;34.80;10;348.00
10926;2009;7;9-7-2009;514.40;Ana Trujillo Emparedados y helados;Mexico;Konbu;Seafood;6.00;10;60.00
10920;2009;7;8-7-2009;390.00;Around the Horn;UK;Valkoinen suklaa;Confections;16.25;24;390.00
10921;2009;7;8-7-2009;1936.00;Vaffeljernet;Denmark;Steeleye Stout;Beverages;18.00;10;180.00
10921;2009;7;8-7-2009;1936.00;Vaffeljernet;Denmark;Vegie-spread;Condiments;43.90;40;1756.00
10922;2009;7;8-7-2009;742.50;Hanari Carnes;Brazil;Guaran� Fant�stica;Beverages;4.50;35;157.50
10922;2009;7;8-7-2009;742.50;Hanari Carnes;Brazil;Alice Mutton;Meat/Poultry;39.00;15;585.00
10923;2009;7;8-7-2009;936.00;La maison d'Asie;France;Ipoh Coffee;Beverages;46.00;10;460.00
10923;2009;7;8-7-2009;936.00;La maison d'Asie;France;Laughing Lumberjack Lager;Beverages;14.00;24;336.00
10923;2009;7;8-7-2009;936.00;La maison d'Asie;France;Singaporean Hokkien Fried Mee;Grains/Cereals;14.00;10;140.00
10917;2009;7;7-7-2009;365.89;Romero y tomillo;Spain;Camembert Pierrot;Dairy Products;34.00;10;340.00
10917;2009;7;7-7-2009;365.89;Romero y tomillo;Spain;Nord-Ost Matjeshering;Seafood;25.89;1;25.89
10918;2009;7;7-7-2009;1930.00;Bottom-Dollar Markets;Canada;Chai;Beverages;18.00;60;1080.00
10918;2009;7;7-7-2009;1930.00;Bottom-Dollar Markets;Canada;Camembert Pierrot;Dairy Products;34.00;25;850.00
10919;2009;7;7-7-2009;1122.80;LINO-Delicateses;Venezuela;Pavlova;Confections;17.45;24;418.80
10919;2009;7;7-7-2009;1122.80;LINO-Delicateses;Venezuela;NuNuCa Nu�-Nougat-Creme;Confections;14.00;24;336.00
10919;2009;7;7-7-2009;1122.80;LINO-Delicateses;Venezuela;Boston Crab Meat;Seafood;18.40;20;368.00
10914;2009;7;4-7-2009;537.50;Queen Cozinha;Brazil;Fl�temysost;Dairy Products;21.50;25;537.50
10915;2009;7;4-7-2009;539.50;Tortuga Restaurante;Mexico;Geitost;Dairy Products;2.50;30;75.00
10915;2009;7;4-7-2009;539.50;Tortuga Restaurante;Mexico;Alice Mutton;Meat/Poultry;39.00;10;390.00
10915;2009;7;4-7-2009;539.50;Tortuga Restaurante;Mexico;Tourti�re;Meat/Poultry;7.45;10;74.50
10916;2009;7;4-7-2009;686.70;Rancho grande;Argentina;Pavlova;Confections;17.45;6;104.70
10916;2009;7;4-7-2009;686.70;Rancho grande;Argentina;Mascarpone Fabioli;Dairy Products;32.00;6;192.00
10916;2009;7;4-7-2009;686.70;Rancho grande;Argentina;Ravioli Angelo;Grains/Cereals;19.50;20;390.00
10908;2009;7;3-7-2009;698.00;Reggiani Caseifici;Italy;Filo Mix;Grains/Cereals;7.00;14;98.00
10908;2009;7;3-7-2009;698.00;Reggiani Caseifici;Italy;Uncle Bob's Organic Dried Pears;Produce;30.00;20;600.00
10909;2009;7;3-7-2009;670.00;Sant� Gourmet;Norway;Pavlova;Confections;17.45;15;261.75
10909;2009;7;3-7-2009;670.00;Sant� Gourmet;Norway;Uncle Bob's Organic Dried Pears;Produce;30.00;12;360.00
10909;2009;7;3-7-2009;670.00;Sant� Gourmet;Norway;Jack's New England Clam Chowder;Seafood;9.65;5;48.25
10910;2009;7;3-7-2009;452.90;Wilman Kala;Finland;Sirop d'�rable;Condiments;28.50;5;142.50
10910;2009;7;3-7-2009;452.90;Wilman Kala;Finland;Teatime Chocolate Biscuits;Confections;9.20;12;110.40
10910;2009;7;3-7-2009;452.90;Wilman Kala;Finland;Maxilaku;Confections;20.00;10;200.00
10911;2009;7;3-7-2009;858.00;Godos Cocina T�pica;Spain;Chai;Beverages;18.00;10;180.00
10911;2009;7;3-7-2009;858.00;Godos Cocina T�pica;Spain;Laughing Lumberjack Lager;Beverages;14.00;15;210.00
10911;2009;7;3-7-2009;858.00;Godos Cocina T�pica;Spain;Alice Mutton;Meat/Poultry;39.00;12;468.00
10912;2009;7;3-7-2009;8267.40;Hungry Owl All-Night Grocers;Ireland;Queso Cabrales;Dairy Products;21.00;40;840.00
10912;2009;7;3-7-2009;8267.40;Hungry Owl All-Night Grocers;Ireland;Th�ringer Rostbratwurst;Meat/Poultry;123.79;60;7427.40
10913;2009;7;3-7-2009;958.75;Queen Cozinha;Brazil;Chef Anton's Cajun Seasoning;Condiments;22.00;30;660.00
10913;2009;7;3-7-2009;958.75;Queen Cozinha;Brazil;Geitost;Dairy Products;2.50;40;100.00
10913;2009;7;3-7-2009;958.75;Queen Cozinha;Brazil;Escargots de Bourgogne;Seafood;13.25;15;198.75
10906;2009;7;2-7-2009;427.50;Wolski  Zajazd;Poland;Sirop d'�rable;Condiments;28.50;15;427.50
10907;2009;7;2-7-2009;108.50;Sp�cialit�s du monde;France;Rh�nbr�u Klosterbier;Beverages;7.75;14;108.50
10903;2009;7;1-7-2009;932.05;Hanari Carnes;Brazil;Louisiana Fiery Hot Pepper Sauce;Condiments;21.05;21;442.05
10903;2009;7;1-7-2009;932.05;Hanari Carnes;Brazil;Scottish Longbreads;Confections;12.50;20;250.00
10903;2009;7;1-7-2009;932.05;Hanari Carnes;Brazil;Konbu;Seafood;6.00;40;240.00
10904;2009;7;1-7-2009;1924.25;White Clover Markets;USA;Tarte au sucre;Confections;49.30;35;1725.50
10904;2009;7;1-7-2009;1924.25;White Clover Markets;USA;Escargots de Bourgogne;Seafood;13.25;15;198.75
10905;2009;7;1-7-2009;360.00;Wellington Importadora;Brazil;Chai;Beverages;18.00;20;360.00
10901;2009;6;30-6-2009;934.50;HILARI�N-Abastos;Venezuela;Fl�temysost;Dairy Products;21.50;30;645.00
10901;2009;6;30-6-2009;934.50;HILARI�N-Abastos;Venezuela;Jack's New England Clam Chowder;Seafood;9.65;30;289.50
10902;2009;6;30-6-2009;1015.80;Folk och f� HB;Sweden;Tarte au sucre;Confections;49.30;6;295.80
10902;2009;6;30-6-2009;1015.80;Folk och f� HB;Sweden;P�t� chinois;Meat/Poultry;24.00;30;720.00
10898;2009;6;27-6-2009;30.00;Oc�ano Atl�ntico Ltda;Argentina;Konbu;Seafood;6.00;5;30.00
10899;2009;6;27-6-2009;144.00;LILA-Supermercado;Venezuela;Chartreuse verte;Beverages;18.00;8;144.00
10900;2009;6;27-6-2009;45.00;Wellington Importadora;Brazil;Outback Lager;Beverages;15.00;3;45.00
10896;2009;6;26-6-2009;750.50;Maison Dewey;Belgium;Gnocchi di nonna Alice;Grains/Cereals;38.00;16;608.00
10896;2009;6;26-6-2009;750.50;Maison Dewey;Belgium;R�gede sild;Seafood;9.50;15;142.50
10897;2009;6;26-6-2009;10835.24;Hungry Owl All-Night Grocers;Ireland;Th�ringer Rostbratwurst;Meat/Poultry;123.79;80;9903.20
10897;2009;6;26-6-2009;10835.24;Hungry Owl All-Night Grocers;Ireland;Nord-Ost Matjeshering;Seafood;25.89;36;932.04
10893;2009;6;25-6-2009;5502.11;K�niglich Essen;Germany;Guaran� Fant�stica;Beverages;4.50;10;45.00
10893;2009;6;25-6-2009;5502.11;K�niglich Essen;Germany;Northwoods Cranberry Sauce;Condiments;40.00;30;1200.00
10893;2009;6;25-6-2009;5502.11;K�niglich Essen;Germany;Th�ringer Rostbratwurst;Meat/Poultry;123.79;24;2970.96
10893;2009;6;25-6-2009;5502.11;K�niglich Essen;Germany;Nord-Ost Matjeshering;Seafood;25.89;35;906.15
10893;2009;6;25-6-2009;5502.11;K�niglich Essen;Germany;Inlagd Sill;Seafood;19.00;20;380.00
10894;2009;6;25-6-2009;2898.00;Save-a-lot Markets;USA;Rh�nbr�u Klosterbier;Beverages;7.75;120;930.00
10894;2009;6;25-6-2009;2898.00;Save-a-lot Markets;USA;Gudbrandsdalsost;Dairy Products;36.00;50;1800.00
10894;2009;6;25-6-2009;2898.00;Save-a-lot Markets;USA;Konbu;Seafood;6.00;28;168.00
10895;2009;6;25-6-2009;6379.40;Ernst Handel;Austria;Guaran� Fant�stica;Beverages;4.50;110;495.00
10895;2009;6;25-6-2009;6379.40;Ernst Handel;Austria;Chartreuse verte;Beverages;18.00;45;810.00
10895;2009;6;25-6-2009;6379.40;Ernst Handel;Austria;Camembert Pierrot;Dairy Products;34.00;100;3400.00
10895;2009;6;25-6-2009;6379.40;Ernst Handel;Austria;Boston Crab Meat;Seafood;18.40;91;1674.40
10891;2009;6;24-6-2009;388.35;Lehmanns Marktstand;Germany;Nord-Ost Matjeshering;Seafood;25.89;15;388.35
10892;2009;6;24-6-2009;2200.00;Maison Dewey;Belgium;Raclette Courdavault;Dairy Products;55.00;40;2200.00
10888;2009;6;23-6-2009;605.00;Godos Cocina T�pica;Spain;Chang;Beverages;19.00;20;380.00
10888;2009;6;23-6-2009;605.00;Godos Cocina T�pica;Spain;Scottish Longbreads;Confections;12.50;18;225.00
10889;2009;6;23-6-2009;11380.00;Rattlesnake Canyon Grocery;USA;C�te de Blaye;Beverages;263.50;40;10540.00
10889;2009;6;23-6-2009;11380.00;Rattlesnake Canyon Grocery;USA;Queso Cabrales;Dairy Products;21.00;40;840.00
10890;2009;6;23-6-2009;860.10;Du monde entier;France;Sasquatch Ale;Beverages;14.00;10;140.00
10890;2009;6;23-6-2009;860.10;Du monde entier;France;Alice Mutton;Meat/Poultry;39.00;15;585.00
10890;2009;6;23-6-2009;860.10;Du monde entier;France;Jack's New England Clam Chowder;Seafood;9.65;14;135.10
10886;2009;6;20-6-2009;3127.50;Hanari Carnes;Brazil;Original Frankfurter gr�ne So�e;Condiments;13.00;40;520.00
10886;2009;6;20-6-2009;3127.50;Hanari Carnes;Brazil;Gorgonzola Telino;Dairy Products;12.50;35;437.50
10886;2009;6;20-6-2009;3127.50;Hanari Carnes;Brazil;Ikura;Seafood;31.00;70;2170.00
10887;2009;6;20-6-2009;70.00;Galer�a del gastr�nomo;Spain;NuNuCa Nu�-Nougat-Creme;Confections;14.00;5;70.00
10883;2009;6;19-6-2009;36.00;Lonesome Pine Restaurant;USA;Guaran� Fant�stica;Beverages;4.50;8;36.00
10884;2009;6;19-6-2009;1450.60;Let's Stop N Shop;USA;Louisiana Fiery Hot Pepper Sauce;Condiments;21.05;12;252.60
10884;2009;6;19-6-2009;1450.60;Let's Stop N Shop;USA;Sir Rodney's Scones;Confections;10.00;40;400.00
10884;2009;6;19-6-2009;1450.60;Let's Stop N Shop;USA;Gnocchi di nonna Alice;Grains/Cereals;38.00;21;798.00
10885;2009;6;19-6-2009;1209.00;Supr�mes d�lices;Belgium;Chang;Beverages;19.00;20;380.00
10885;2009;6;19-6-2009;1209.00;Supr�mes d�lices;Belgium;Guaran� Fant�stica;Beverages;4.50;12;54.00
10885;2009;6;19-6-2009;1209.00;Supr�mes d�lices;Belgium;Outback Lager;Beverages;15.00;30;450.00
10885;2009;6;19-6-2009;1209.00;Supr�mes d�lices;Belgium;Original Frankfurter gr�ne So�e;Condiments;13.00;25;325.00
10881;2009;6;18-6-2009;150.00;Cactus Comidas para llevar;Argentina;R�d Kaviar;Seafood;15.00;10;150.00
10882;2009;6;18-6-2009;988.40;Save-a-lot Markets;USA;Maxilaku;Confections;20.00;20;400.00
10882;2009;6;18-6-2009;988.40;Save-a-lot Markets;USA;Singaporean Hokkien Fried Mee;Grains/Cereals;14.00;25;350.00
10882;2009;6;18-6-2009;988.40;Save-a-lot Markets;USA;Tourti�re;Meat/Poultry;7.45;32;238.40
10878;2009;6;17-6-2009;1620.00;QUICK-Stop;Germany;Sir Rodney's Marmalade;Confections;81.00;20;1620.00
10879;2009;6;17-6-2009;611.30;Wilman Kala;Finland;Lakkalik��ri;Beverages;18.00;10;180.00
10879;2009;6;17-6-2009;611.30;Wilman Kala;Finland;Louisiana Fiery Hot Pepper Sauce;Condiments;21.05;10;210.50
10879;2009;6;17-6-2009;611.30;Wilman Kala;Finland;Boston Crab Meat;Seafood;18.40;12;220.80
10880;2009;6;17-6-2009;1875.00;Folk och f� HB;Sweden;Outback Lager;Beverages;15.00;50;750.00
10880;2009;6;17-6-2009;1875.00;Folk och f� HB;Sweden;Sirop d'�rable;Condiments;28.50;30;855.00
10880;2009;6;17-6-2009;1875.00;Folk och f� HB;Sweden;Tunnbr�d;Grains/Cereals;9.00;30;270.00
10876;2009;6;16-6-2009;917.00;Bon app';France;Wimmers gute Semmelkn�del;Grains/Cereals;33.25;20;665.00
10876;2009;6;16-6-2009;917.00;Bon app';France;Spegesild;Seafood;12.00;21;252.00
10877;2009;6;16-6-2009;2086.00;Ricardo Adocicados;Brazil;Pavlova;Confections;17.45;30;523.50
10877;2009;6;16-6-2009;2086.00;Ricardo Adocicados;Brazil;Carnarvon Tigers;Seafood;62.50;25;1562.50
10873;2009;6;13-6-2009;336.80;Wilman Kala;Finland;Sir Rodney's Scones;Confections;10.00;20;200.00
10873;2009;6;13-6-2009;336.80;Wilman Kala;Finland;R�ssle Sauerkraut;Produce;45.60;3;136.80
10874;2009;6;13-6-2009;310.00;Godos Cocina T�pica;Spain;Ikura;Seafood;31.00;10;310.00
10875;2009;6;13-6-2009;729.50;Berglunds snabbk�p;Sweden;Teatime Chocolate Biscuits;Confections;9.20;25;230.00
10875;2009;6;13-6-2009;729.50;Berglunds snabbk�p;Sweden;Zaanse koeken;Confections;9.50;21;199.50
10875;2009;6;13-6-2009;729.50;Berglunds snabbk�p;Sweden;Maxilaku;Confections;20.00;15;300.00
10871;2009;6;12-6-2009;2083.40;Bon app';France;Grandma's Boysenberry Spread;Condiments;25.00;50;1250.00
10871;2009;6;12-6-2009;2083.40;Bon app';France;Pavlova;Confections;17.45;12;209.40
10871;2009;6;12-6-2009;2083.40;Bon app';France;Alice Mutton;Meat/Poultry;39.00;16;624.00
10872;2009;6;12-6-2009;2166.80;Godos Cocina T�pica;Spain;Louisiana Fiery Hot Pepper Sauce;Condiments;21.05;21;442.05
10872;2009;6;12-6-2009;2166.80;Godos Cocina T�pica;Spain;Tarte au sucre;Confections;49.30;20;986.00
10872;2009;6;12-6-2009;2166.80;Godos Cocina T�pica;Spain;Wimmers gute Semmelkn�del;Grains/Cereals;33.25;15;498.75
10872;2009;6;12-6-2009;2166.80;Godos Cocina T�pica;Spain;P�t� chinois;Meat/Poultry;24.00;10;240.00
10868;2009;6;11-6-2009;2004.60;Queen Cozinha;Brazil;Steeleye Stout;Beverages;18.00;30;540.00
10868;2009;6;11-6-2009;2004.60;Queen Cozinha;Brazil;Gumb�r Gummib�rchen;Confections;31.23;20;624.60
10868;2009;6;11-6-2009;2004.60;Queen Cozinha;Brazil;Maxilaku;Confections;20.00;42;840.00
10869;2009;6;11-6-2009;1630.00;Seven Seas Imports;UK;Chai;Beverages;18.00;40;720.00
10869;2009;6;11-6-2009;1630.00;Seven Seas Imports;UK;Scottish Longbreads;Confections;12.50;20;250.00
10869;2009;6;11-6-2009;1630.00;Seven Seas Imports;UK;Queso Cabrales;Dairy Products;21.00;10;210.00
10869;2009;6;11-6-2009;1630.00;Seven Seas Imports;UK;Tunnbr�d;Grains/Cereals;9.00;50;450.00
10870;2009;6;11-6-2009;160.00;Wolski  Zajazd;Poland;Steeleye Stout;Beverages;18.00;3;54.00
10870;2009;6;11-6-2009;160.00;Wolski  Zajazd;Poland;Manjimup Dried Apples;Produce;53.00;2;106.00
10866;2009;6;10-6-2009;1461.60;Berglunds snabbk�p;Sweden;Chang;Beverages;19.00;21;399.00
10866;2009;6;10-6-2009;1461.60;Berglunds snabbk�p;Sweden;Guaran� Fant�stica;Beverages;4.50;6;27.00
10866;2009;6;10-6-2009;1461.60;Berglunds snabbk�p;Sweden;Nord-Ost Matjeshering;Seafood;25.89;40;1035.60
10867;2009;6;10-6-2009;98.40;Lonesome Pine Restaurant;USA;Perth Pasties;Meat/Poultry;32.80;3;98.40
10863;2009;6;9-6-2009;519.00;HILARI�N-Abastos;Venezuela;Chai;Beverages;18.00;20;360.00
10863;2009;6;9-6-2009;519.00;HILARI�N-Abastos;Venezuela;Escargots de Bourgogne;Seafood;13.25;12;159.00
10864;2009;6;9-6-2009;282.00;Around the Horn;UK;Steeleye Stout;Beverages;18.00;4;72.00
10864;2009;6;9-6-2009;282.00;Around the Horn;UK;Laughing Lumberjack Lager;Beverages;14.00;15;210.00
10865;2009;6;9-6-2009;17250.00;QUICK-Stop;Germany;C�te de Blaye;Beverages;263.50;60;15810.00
10865;2009;6;9-6-2009;17250.00;QUICK-Stop;Germany;Chartreuse verte;Beverages;18.00;80;1440.00
10861;2009;6;6-6-2009;3523.40;White Clover Markets;USA;Sir Rodney's Scones;Confections;10.00;40;400.00
10861;2009;6;6-6-2009;3523.40;White Clover Markets;USA;Tarte au sucre;Confections;49.30;3;147.90
10861;2009;6;6-6-2009;3523.40;White Clover Markets;USA;Geitost;Dairy Products;2.50;35;87.50
10861;2009;6;6-6-2009;3523.40;White Clover Markets;USA;Alice Mutton;Meat/Poultry;39.00;42;1638.00
10861;2009;6;6-6-2009;3523.40;White Clover Markets;USA;Carnarvon Tigers;Seafood;62.50;20;1250.00
10862;2009;6;6-6-2009;581.00;Lehmanns Marktstand;Germany;Queso Cabrales;Dairy Products;21.00;25;525.00
10862;2009;6;6-6-2009;581.00;Lehmanns Marktstand;Germany;Filo Mix;Grains/Cereals;7.00;8;56.00
10858;2009;6;5-6-2009;649.00;La corne d'abondance;France;Outback Lager;Beverages;15.00;4;60.00
10858;2009;6;5-6-2009;649.00;La corne d'abondance;France;Schoggi Schokolade;Confections;43.90;10;439.00
10858;2009;6;5-6-2009;649.00;La corne d'abondance;France;Uncle Bob's Organic Dried Pears;Produce;30.00;5;150.00
10859;2009;6;5-6-2009;1438.25;Frankenversand;Germany;Guaran� Fant�stica;Beverages;4.50;40;180.00
10859;2009;6;5-6-2009;1438.25;Frankenversand;Germany;Wimmers gute Semmelkn�del;Grains/Cereals;33.25;30;997.50
10859;2009;6;5-6-2009;1438.25;Frankenversand;Germany;Tourti�re;Meat/Poultry;7.45;35;260.75
10860;2009;6;5-6-2009;519.00;France restauration;France;Lakkalik��ri;Beverages;18.00;20;360.00
10860;2009;6;5-6-2009;519.00;France restauration;France;Manjimup Dried Apples;Produce;53.00;3;159.00
10856;2009;6;4-6-2009;660.00;Antonio Moreno Taquer�a;Mexico;Chang;Beverages;19.00;20;380.00
10856;2009;6;4-6-2009;660.00;Antonio Moreno Taquer�a;Mexico;Singaporean Hokkien Fried Mee;Grains/Cereals;14.00;20;280.00
10857;2009;6;4-6-2009;2630.95;Berglunds snabbk�p;Sweden;Aniseed Syrup;Condiments;10.00;30;300.00
10857;2009;6;4-6-2009;2630.95;Berglunds snabbk�p;Sweden;Gumb�r Gummib�rchen;Confections;31.23;35;1093.05
10857;2009;6;4-6-2009;2630.95;Berglunds snabbk�p;Sweden;Th�ringer Rostbratwurst;Meat/Poultry;123.79;10;1237.90
10853;2009;6;3-6-2009;625.00;Blauer See Delikatessen;Germany;Carnarvon Tigers;Seafood;62.50;10;625.00
10854;2009;6;3-6-2009;3490.00;Ernst Handel;Austria;Ikura;Seafood;31.00;100;3100.00
10854;2009;6;3-6-2009;3490.00;Ernst Handel;Austria;Konbu;Seafood;6.00;65;390.00
10855;2009;6;3-6-2009;2275.25;Old World Delicatessen;USA;Louisiana Fiery Hot Pepper Sauce;Condiments;21.05;15;315.75
10855;2009;6;3-6-2009;2275.25;Old World Delicatessen;USA;Pavlova;Confections;17.45;50;872.50
10855;2009;6;3-6-2009;2275.25;Old World Delicatessen;USA;Gorgonzola Telino;Dairy Products;12.50;14;175.00
10855;2009;6;3-6-2009;2275.25;Old World Delicatessen;USA;Gnocchi di nonna Alice;Grains/Cereals;38.00;24;912.00
10851;2009;6;2-6-2009;2740.00;Ricardo Adocicados;Brazil;Chang;Beverages;19.00;5;95.00
10851;2009;6;2-6-2009;2740.00;Ricardo Adocicados;Brazil;NuNuCa Nu�-Nougat-Creme;Confections;14.00;10;140.00
10851;2009;6;2-6-2009;2740.00;Ricardo Adocicados;Brazil;Raclette Courdavault;Dairy Products;55.00;42;2310.00
10851;2009;6;2-6-2009;2740.00;Ricardo Adocicados;Brazil;Ravioli Angelo;Grains/Cereals;19.50;10;195.00
10852;2009;6;2-6-2009;2984.00;Rattlesnake Canyon Grocery;USA;Chang;Beverages;19.00;15;285.00
10852;2009;6;2-6-2009;2984.00;Rattlesnake Canyon Grocery;USA;Tarte au sucre;Confections;49.30;50;2465.00
10852;2009;6;2-6-2009;2984.00;Rattlesnake Canyon Grocery;USA;Alice Mutton;Meat/Poultry;39.00;6;234.00
10848;2009;5;30-5-2009;931.50;Consolidated Holdings;UK;Chef Anton's Gumbo Mix;Condiments;21.35;30;640.50
10848;2009;5;30-5-2009;931.50;Consolidated Holdings;UK;Mishi Kobe Niku;Meat/Poultry;97.00;3;291.00
10849;2009;5;30-5-2009;1052.14;K�niglich Essen;Germany;Aniseed Syrup;Condiments;10.00;49;490.00
10849;2009;5;30-5-2009;1052.14;K�niglich Essen;Germany;Gumb�r Gummib�rchen;Confections;31.23;18;562.14
10850;2009;5;30-5-2009;740.00;Victuailles en stock;France;Outback Lager;Beverages;15.00;30;450.00
10850;2009;5;30-5-2009;740.00;Victuailles en stock;France;NuNuCa Nu�-Nougat-Creme;Confections;14.00;20;280.00
10850;2009;5;30-5-2009;740.00;Victuailles en stock;France;Geitost;Dairy Products;2.50;4;10.00
10846;2009;5;29-5-2009;1112.00;Supr�mes d�lices;Belgium;Outback Lager;Beverages;15.00;30;450.00
10846;2009;5;29-5-2009;1112.00;Supr�mes d�lices;Belgium;Chef Anton's Cajun Seasoning;Condiments;22.00;21;462.00
10846;2009;5;29-5-2009;1112.00;Supr�mes d�lices;Belgium;Longlife Tofu;Produce;10.00;20;200.00
10847;2009;5;29-5-2009;6164.90;Save-a-lot Markets;USA;Chai;Beverages;18.00;80;1440.00
10847;2009;5;29-5-2009;6164.90;Save-a-lot Markets;USA;Teatime Chocolate Biscuits;Confections;9.20;12;110.40
10847;2009;5;29-5-2009;6164.90;Save-a-lot Markets;USA;Camembert Pierrot;Dairy Products;34.00;45;1530.00
10847;2009;5;29-5-2009;6164.90;Save-a-lot Markets;USA;Fl�temysost;Dairy Products;21.50;55;1182.50
10847;2009;5;29-5-2009;6164.90;Save-a-lot Markets;USA;Gravad lax;Seafood;26.00;60;1560.00
10847;2009;5;29-5-2009;6164.90;Save-a-lot Markets;USA;R�gede sild;Seafood;9.50;36;342.00
10843;2009;5;28-5-2009;212.00;Victuailles en stock;France;Manjimup Dried Apples;Produce;53.00;4;212.00
10844;2009;5;28-5-2009;735.00;Piccolo und mehr;Austria;Gustaf's Kn�ckebr�d;Grains/Cereals;21.00;35;735.00
10845;2009;5;28-5-2009;4059.00;QUICK-Stop;Germany;Steeleye Stout;Beverages;18.00;25;450.00
10845;2009;5;28-5-2009;4059.00;QUICK-Stop;Germany;Tunnbr�d;Grains/Cereals;9.00;70;630.00
10845;2009;5;28-5-2009;4059.00;QUICK-Stop;Germany;Singaporean Hokkien Fried Mee;Grains/Cereals;14.00;42;588.00
10845;2009;5;28-5-2009;4059.00;QUICK-Stop;Germany;Wimmers gute Semmelkn�del;Grains/Cereals;33.25;48;1596.00
10845;2009;5;28-5-2009;4059.00;QUICK-Stop;Germany;Escargots de Bourgogne;Seafood;13.25;60;795.00
10841;2009;5;27-5-2009;4581.00;Supr�mes d�lices;Belgium;Original Frankfurter gr�ne So�e;Condiments;13.00;15;195.00
10841;2009;5;27-5-2009;4581.00;Supr�mes d�lices;Belgium;Raclette Courdavault;Dairy Products;55.00;50;2750.00
10841;2009;5;27-5-2009;4581.00;Supr�mes d�lices;Belgium;Gnocchi di nonna Alice;Grains/Cereals;38.00;30;1140.00
10841;2009;5;27-5-2009;4581.00;Supr�mes d�lices;Belgium;Ikura;Seafood;31.00;16;496.00
10842;2009;5;27-5-2009;975.00;Tortuga Restaurante;Mexico;Ipoh Coffee;Beverages;46.00;5;230.00
10842;2009;5;27-5-2009;975.00;Tortuga Restaurante;Mexico;Outback Lager;Beverages;15.00;12;180.00
10842;2009;5;27-5-2009;975.00;Tortuga Restaurante;Mexico;Scottish Longbreads;Confections;12.50;20;250.00
10842;2009;5;27-5-2009;975.00;Tortuga Restaurante;Mexico;Queso Cabrales;Dairy Products;21.00;15;315.00
10838;2009;5;26-5-2009;2584.50;LINO-Delicateses;Venezuela;Chai;Beverages;18.00;4;72.00
10838;2009;5;26-5-2009;2584.50;LINO-Delicateses;Venezuela;Carnarvon Tigers;Seafood;62.50;25;1562.50
10838;2009;5;26-5-2009;2584.50;LINO-Delicateses;Venezuela;Inlagd Sill;Seafood;19.00;50;950.00
10839;2009;5;26-5-2009;919.50;Tradi��o Hipermercados;Brazil;Mozzarella di Giovanni;Dairy Products;34.80;15;522.00
10839;2009;5;26-5-2009;919.50;Tradi��o Hipermercados;Brazil;Escargots de Bourgogne;Seafood;13.25;30;397.50
10840;2009;5;26-5-2009;264.00;LINO-Delicateses;Venezuela;Chartreuse verte;Beverages;18.00;10;180.00
10840;2009;5;26-5-2009;264.00;LINO-Delicateses;Venezuela;NuNuCa Nu�-Nougat-Creme;Confections;14.00;6;84.00
10836;2009;5;23-5-2009;4705.50;Ernst Handel;Austria;Steeleye Stout;Beverages;18.00;6;108.00
10836;2009;5;23-5-2009;4705.50;Ernst Handel;Austria;Camembert Pierrot;Dairy Products;34.00;60;2040.00
10836;2009;5;23-5-2009;4705.50;Ernst Handel;Austria;Gustaf's Kn�ckebr�d;Grains/Cereals;21.00;52;1092.00
10836;2009;5;23-5-2009;4705.50;Ernst Handel;Austria;Ravioli Angelo;Grains/Cereals;19.50;24;468.00
10836;2009;5;23-5-2009;4705.50;Ernst Handel;Austria;Wimmers gute Semmelkn�del;Grains/Cereals;33.25;30;997.50
10837;2009;5;23-5-2009;1254.00;Berglunds snabbk�p;Sweden;Lakkalik��ri;Beverages;18.00;21;378.00
10837;2009;5;23-5-2009;1254.00;Berglunds snabbk�p;Sweden;Zaanse koeken;Confections;9.50;40;380.00
10837;2009;5;23-5-2009;1254.00;Berglunds snabbk�p;Sweden;Konbu;Seafood;6.00;6;36.00
10837;2009;5;23-5-2009;1254.00;Berglunds snabbk�p;Sweden;Boston Crab Meat;Seafood;18.40;25;460.00
10833;2009;5;22-5-2009;1007.70;Ottilies K�seladen;Germany;Gorgonzola Telino;Dairy Products;12.50;9;112.50
10833;2009;5;22-5-2009;1007.70;Ottilies K�seladen;Germany;Perth Pasties;Meat/Poultry;32.80;9;295.20
10833;2009;5;22-5-2009;1007.70;Ottilies K�seladen;Germany;Uncle Bob's Organic Dried Pears;Produce;30.00;20;600.00
10834;2009;5;22-5-2009;1508.12;Tradi��o Hipermercados;Brazil;Th�ringer Rostbratwurst;Meat/Poultry;123.79;8;990.32
10834;2009;5;22-5-2009;1508.12;Tradi��o Hipermercados;Brazil;Nord-Ost Matjeshering;Seafood;25.89;20;517.80
10835;2009;5;22-5-2009;851.00;Alfreds Futterkiste;Germany;Original Frankfurter gr�ne So�e;Condiments;13.00;2;26.00
10835;2009;5;22-5-2009;851.00;Alfreds Futterkiste;Germany;Raclette Courdavault;Dairy Products;55.00;15;825.00
10831;2009;5;21-5-2009;2684.40;Sant� Gourmet;Norway;Steeleye Stout;Beverages;18.00;8;144.00
10831;2009;5;21-5-2009;2684.40;Sant� Gourmet;Norway;C�te de Blaye;Beverages;263.50;8;2108.00
10831;2009;5;21-5-2009;2684.40;Sant� Gourmet;Norway;Ipoh Coffee;Beverages;46.00;9;414.00
10831;2009;5;21-5-2009;2684.40;Sant� Gourmet;Norway;Teatime Chocolate Biscuits;Confections;9.20;2;18.40
10832;2009;5;21-5-2009;568.95;La maison d'Asie;France;Gula Malacca;Condiments;19.45;16;311.20
10832;2009;5;21-5-2009;568.95;La maison d'Asie;France;NuNuCa Nu�-Nougat-Creme;Confections;14.00;10;140.00
10832;2009;5;21-5-2009;568.95;La maison d'Asie;France;Wimmers gute Semmelkn�del;Grains/Cereals;33.25;3;99.75
10832;2009;5;21-5-2009;568.95;La maison d'Asie;France;Konbu;Seafood;6.00;3;18.00
10828;2009;5;20-5-2009;932.00;Rancho grande;Argentina;C�te de Blaye;Beverages;263.50;2;527.00
10828;2009;5;20-5-2009;932.00;Rancho grande;Argentina;Sir Rodney's Marmalade;Confections;81.00;5;405.00
10829;2009;5;20-5-2009;1764.00;Island Trading;UK;Chang;Beverages;19.00;10;190.00
10829;2009;5;20-5-2009;1764.00;Island Trading;UK;Northwoods Cranberry Sauce;Condiments;40.00;20;800.00
10829;2009;5;20-5-2009;1764.00;Island Trading;UK;Camembert Pierrot;Dairy Products;34.00;21;714.00
10829;2009;5;20-5-2009;1764.00;Island Trading;UK;Konbu;Seafood;6.00;10;60.00
10830;2009;5;20-5-2009;1974.00;Tradi��o Hipermercados;Brazil;Chartreuse verte;Beverages;18.00;28;504.00
10830;2009;5;20-5-2009;1974.00;Tradi��o Hipermercados;Brazil;Grandma's Boysenberry Spread;Condiments;25.00;6;150.00
10830;2009;5;20-5-2009;1974.00;Tradi��o Hipermercados;Brazil;Scottish Longbreads;Confections;12.50;24;300.00
10830;2009;5;20-5-2009;1974.00;Tradi��o Hipermercados;Brazil;Camembert Pierrot;Dairy Products;34.00;30;1020.00
10826;2009;5;19-5-2009;730.00;Blondel p�re et fils;France;Gorgonzola Telino;Dairy Products;12.50;35;437.50
10826;2009;5;19-5-2009;730.00;Blondel p�re et fils;France;Ravioli Angelo;Grains/Cereals;19.50;15;292.50
10827;2009;5;19-5-2009;843.00;Bon app';France;Chartreuse verte;Beverages;18.00;21;378.00
10827;2009;5;19-5-2009;843.00;Bon app';France;Ikura;Seafood;31.00;15;465.00
10823;2009;5;16-5-2009;3107.50;LILA-Supermercado;Venezuela;Original Frankfurter gr�ne So�e;Condiments;13.00;15;195.00
10823;2009;5;16-5-2009;3107.50;LILA-Supermercado;Venezuela;Queso Cabrales;Dairy Products;21.00;20;420.00
10823;2009;5;16-5-2009;3107.50;LILA-Supermercado;Venezuela;Raclette Courdavault;Dairy Products;55.00;40;2200.00
10823;2009;5;16-5-2009;3107.50;LILA-Supermercado;Venezuela;Ravioli Angelo;Grains/Cereals;19.50;15;292.50
10824;2009;5;16-5-2009;250.80;Folk och f� HB;Sweden;Outback Lager;Beverages;15.00;9;135.00
10824;2009;5;16-5-2009;250.80;Folk och f� HB;Sweden;Jack's New England Clam Chowder;Seafood;9.65;12;115.80
10825;2009;5;16-5-2009;1030.76;Drachenblut Delikatessen;Germany;Gumb�r Gummib�rchen;Confections;31.23;12;374.76
10825;2009;5;16-5-2009;1030.76;Drachenblut Delikatessen;Germany;Perth Pasties;Meat/Poultry;32.80;20;656.00
10821;2009;5;15-5-2009;678.00;Split Rail Beer & Ale;USA;Steeleye Stout;Beverages;18.00;20;360.00
10821;2009;5;15-5-2009;678.00;Split Rail Beer & Ale;USA;Manjimup Dried Apples;Produce;53.00;6;318.00
10822;2009;5;15-5-2009;237.90;Trail's Head Gourmet Provisioners;USA;Outback Lager;Beverages;15.00;6;90.00
10822;2009;5;15-5-2009;237.90;Trail's Head Gourmet Provisioners;USA;Tarte au sucre;Confections;49.30;3;147.90
10818;2009;5;14-5-2009;833.00;Magazzini Alimentari Riuniti;Italy;Mascarpone Fabioli;Dairy Products;32.00;20;640.00
10818;2009;5;14-5-2009;833.00;Magazzini Alimentari Riuniti;Italy;Jack's New England Clam Chowder;Seafood;9.65;20;193.00
10819;2009;5;14-5-2009;477.00;Cactus Comidas para llevar;Argentina;Ipoh Coffee;Beverages;46.00;7;322.00
10819;2009;5;14-5-2009;477.00;Cactus Comidas para llevar;Argentina;Rh�nbr�u Klosterbier;Beverages;7.75;20;155.00
10820;2009;5;14-5-2009;1140.00;Rattlesnake Canyon Grocery;USA;Gnocchi di nonna Alice;Grains/Cereals;38.00;30;1140.00
10816;2009;5;13-5-2009;8891.00;Great Lakes Food Market;USA;C�te de Blaye;Beverages;263.50;30;7905.00
10816;2009;5;13-5-2009;8891.00;Great Lakes Food Market;USA;Tarte au sucre;Confections;49.30;20;986.00
10817;2009;5;13-5-2009;11490.70;K�niglich Essen;Germany;C�te de Blaye;Beverages;263.50;30;7905.00
10817;2009;5;13-5-2009;11490.70;K�niglich Essen;Germany;Gumb�r Gummib�rchen;Confections;31.23;40;1249.20
10817;2009;5;13-5-2009;11490.70;K�niglich Essen;Germany;Tarte au sucre;Confections;49.30;25;1232.50
10817;2009;5;13-5-2009;11490.70;K�niglich Essen;Germany;Boston Crab Meat;Seafood;18.40;60;1104.00
10813;2009;5;12-5-2009;648.00;Ricardo Adocicados;Brazil;Chang;Beverages;19.00;12;228.00
10813;2009;5;12-5-2009;648.00;Ricardo Adocicados;Brazil;Spegesild;Seafood;12.00;35;420.00
10814;2009;5;12-5-2009;2070.00;Victuailles en stock;France;Ipoh Coffee;Beverages;46.00;20;920.00
10814;2009;5;12-5-2009;2070.00;Victuailles en stock;France;Sirop d'�rable;Condiments;28.50;30;855.00
10814;2009;5;12-5-2009;2070.00;Victuailles en stock;France;Chocolade;Confections;12.75;8;102.00
10814;2009;5;12-5-2009;2070.00;Victuailles en stock;France;Jack's New England Clam Chowder;Seafood;9.65;20;193.00
10815;2009;5;12-5-2009;40.00;Save-a-lot Markets;USA;Geitost;Dairy Products;2.50;16;40.00
10811;2009;5;9-5-2009;852.00;LINO-Delicateses;Venezuela;Teatime Chocolate Biscuits;Confections;9.20;15;138.00
10811;2009;5;9-5-2009;852.00;LINO-Delicateses;Venezuela;Tunnbr�d;Grains/Cereals;9.00;18;162.00
10811;2009;5;9-5-2009;852.00;LINO-Delicateses;Venezuela;Boston Crab Meat;Seafood;18.40;30;552.00
10812;2009;5;9-5-2009;1852.00;Reggiani Caseifici;Italy;Original Frankfurter gr�ne So�e;Condiments;13.00;20;260.00
10812;2009;5;9-5-2009;1852.00;Reggiani Caseifici;Italy;Gorgonzola Telino;Dairy Products;12.50;16;200.00
10812;2009;5;9-5-2009;1852.00;Reggiani Caseifici;Italy;Mozzarella di Giovanni;Dairy Products;34.80;40;1392.00
10808;2009;5;8-5-2009;1660.00;Old World Delicatessen;USA;Lakkalik��ri;Beverages;18.00;50;900.00
10808;2009;5;8-5-2009;1660.00;Old World Delicatessen;USA;Gnocchi di nonna Alice;Grains/Cereals;38.00;20;760.00
10809;2009;5;8-5-2009;140.00;Wellington Importadora;Brazil;Filo Mix;Grains/Cereals;7.00;20;140.00
10810;2009;5;8-5-2009;187.00;Laughing Bacchus Wine Cellars;Canada;Outback Lager;Beverages;15.00;5;75.00
10810;2009;5;8-5-2009;187.00;Laughing Bacchus Wine Cellars;Canada;NuNuCa Nu�-Nougat-Creme;Confections;14.00;5;70.00
10810;2009;5;8-5-2009;187.00;Laughing Bacchus Wine Cellars;Canada;Konbu;Seafood;6.00;7;42.00
10806;2009;5;7-5-2009;572.10;Victuailles en stock;France;Chang;Beverages;19.00;20;380.00
10806;2009;5;7-5-2009;572.10;Victuailles en stock;France;Louisiana Fiery Hot Pepper Sauce;Condiments;21.05;2;42.10
10806;2009;5;7-5-2009;572.10;Victuailles en stock;France;Longlife Tofu;Produce;10.00;15;150.00
10807;2009;5;7-5-2009;18.40;Franchi SpA;Italy;Boston Crab Meat;Seafood;18.40;1;18.40
10803;2009;5;6-5-2009;1255.80;Wellington Importadora;Brazil;Teatime Chocolate Biscuits;Confections;9.20;24;220.80
10803;2009;5;6-5-2009;1255.80;Wellington Importadora;Brazil;NuNuCa Nu�-Nougat-Creme;Confections;14.00;15;210.00
10803;2009;5;6-5-2009;1255.80;Wellington Importadora;Brazil;Raclette Courdavault;Dairy Products;55.00;15;825.00
10804;2009;5;6-5-2009;2290.40;Seven Seas Imports;UK;Maxilaku;Confections;20.00;4;80.00
10804;2009;5;6-5-2009;2290.40;Seven Seas Imports;UK;R�ssle Sauerkraut;Produce;45.60;24;1094.40
10804;2009;5;6-5-2009;2290.40;Seven Seas Imports;UK;Ikura;Seafood;31.00;36;1116.00
10805;2009;5;6-5-2009;2775.00;The Big Cheese;USA;Sasquatch Ale;Beverages;14.00;10;140.00
10805;2009;5;6-5-2009;2775.00;The Big Cheese;USA;C�te de Blaye;Beverages;263.50;10;2635.00
10801;2009;5;5-5-2009;4035.80;B�lido Comidas preparadas;Spain;Alice Mutton;Meat/Poultry;39.00;40;1560.00
10801;2009;5;5-5-2009;4035.80;B�lido Comidas preparadas;Spain;Th�ringer Rostbratwurst;Meat/Poultry;123.79;20;2475.80
10802;2009;5;5-5-2009;3923.75;Simons bistro;Denmark;Tarte au sucre;Confections;49.30;5;246.50
10802;2009;5;5-5-2009;3923.75;Simons bistro;Denmark;P�t� chinois;Meat/Poultry;24.00;60;1440.00
10802;2009;5;5-5-2009;3923.75;Simons bistro;Denmark;Manjimup Dried Apples;Produce;53.00;30;1590.00
10802;2009;5;5-5-2009;3923.75;Simons bistro;Denmark;Nord-Ost Matjeshering;Seafood;25.89;25;647.25
10798;2009;5;2-5-2009;446.60;Island Trading;UK;Tarte au sucre;Confections;49.30;2;98.60
10798;2009;5;2-5-2009;446.60;Island Trading;UK;Mozzarella di Giovanni;Dairy Products;34.80;10;348.00
10799;2009;5;2-5-2009;1585.00;K�niglich Essen;Germany;Guaran� Fant�stica;Beverages;4.50;20;90.00
10799;2009;5;2-5-2009;1585.00;K�niglich Essen;Germany;Raclette Courdavault;Dairy Products;55.00;25;1375.00
10799;2009;5;2-5-2009;1585.00;K�niglich Essen;Germany;Konbu;Seafood;6.00;20;120.00
10800;2009;5;2-5-2009;1632.15;Seven Seas Imports;UK;Queso Cabrales;Dairy Products;21.00;50;1050.00
10800;2009;5;2-5-2009;1632.15;Seven Seas Imports;UK;Tourti�re;Meat/Poultry;7.45;7;52.15
10800;2009;5;2-5-2009;1632.15;Seven Seas Imports;UK;Manjimup Dried Apples;Produce;53.00;10;530.00
10796;2009;5;1-5-2009;2878.08;HILARI�N-Abastos;Venezuela;Gula Malacca;Condiments;19.45;10;194.50
10796;2009;5;1-5-2009;2878.08;HILARI�N-Abastos;Venezuela;Gumb�r Gummib�rchen;Confections;31.23;21;655.83
10796;2009;5;1-5-2009;2878.08;HILARI�N-Abastos;Venezuela;Gudbrandsdalsost;Dairy Products;36.00;24;864.00
10796;2009;5;1-5-2009;2878.08;HILARI�N-Abastos;Venezuela;Wimmers gute Semmelkn�del;Grains/Cereals;33.25;35;1163.75
10797;2009;5;1-5-2009;420.00;Drachenblut Delikatessen;Germany;Queso Cabrales;Dairy Products;21.00;20;420.00
10793;2009;4;30-4-2009;191.10;Around the Horn;UK;Filo Mix;Grains/Cereals;7.00;8;56.00
10793;2009;4;30-4-2009;191.10;Around the Horn;UK;Jack's New England Clam Chowder;Seafood;9.65;14;135.10
10794;2009;4;30-4-2009;393.45;Que Del�cia;Brazil;Tourti�re;Meat/Poultry;7.45;6;44.70
10794;2009;4;30-4-2009;393.45;Que Del�cia;Brazil;Tofu;Produce;23.25;15;348.75
10795;2009;4;30-4-2009;2499.25;Ernst Handel;Austria;Pavlova;Confections;17.45;65;1134.25
10795;2009;4;30-4-2009;2499.25;Ernst Handel;Austria;Alice Mutton;Meat/Poultry;39.00;35;1365.00
10791;2009;4;29-4-2009;1926.06;Frankenversand;Germany;Th�ringer Rostbratwurst;Meat/Poultry;123.79;14;1733.06
10791;2009;4;29-4-2009;1926.06;Frankenversand;Germany;Jack's New England Clam Chowder;Seafood;9.65;20;193.00
10792;2009;4;29-4-2009;399.85;Wolski  Zajazd;Poland;Chang;Beverages;19.00;10;190.00
10792;2009;4;29-4-2009;399.85;Wolski  Zajazd;Poland;Scottish Longbreads;Confections;12.50;15;187.50
10792;2009;4;29-4-2009;399.85;Wolski  Zajazd;Poland;Tourti�re;Meat/Poultry;7.45;3;22.35
10788;2009;4;28-4-2009;770.00;QUICK-Stop;Germany;Rh�nbr�u Klosterbier;Beverages;7.75;40;310.00
10788;2009;4;28-4-2009;770.00;QUICK-Stop;Germany;Teatime Chocolate Biscuits;Confections;9.20;50;460.00
10789;2009;4;28-4-2009;3687.00;Folies gourmandes;France;Steeleye Stout;Beverages;18.00;15;270.00
10789;2009;4;28-4-2009;3687.00;Folies gourmandes;France;Vegie-spread;Condiments;43.90;30;1317.00
10789;2009;4;28-4-2009;3687.00;Folies gourmandes;France;Scottish Longbreads;Confections;12.50;18;225.00
10789;2009;4;28-4-2009;3687.00;Folies gourmandes;France;Carnarvon Tigers;Seafood;62.50;30;1875.00
10790;2009;4;28-4-2009;850.00;Gourmet Lanchonetes;Brazil;Gnocchi di nonna Alice;Grains/Cereals;38.00;20;760.00
10790;2009;4;28-4-2009;850.00;Gourmet Lanchonetes;Brazil;Uncle Bob's Organic Dried Pears;Produce;30.00;3;90.00
10786;2009;4;25-4-2009;1913.85;Queen Cozinha;Brazil;Rh�nbr�u Klosterbier;Beverages;7.75;42;325.50
10786;2009;4;25-4-2009;1913.85;Queen Cozinha;Brazil;Northwoods Cranberry Sauce;Condiments;40.00;30;1200.00
10786;2009;4;25-4-2009;1913.85;Queen Cozinha;Brazil;Nord-Ost Matjeshering;Seafood;25.89;15;388.35
10787;2009;4;25-4-2009;2760.80;La maison d'Asie;France;Chang;Beverages;19.00;15;285.00
10787;2009;4;25-4-2009;2760.80;La maison d'Asie;France;Th�ringer Rostbratwurst;Meat/Poultry;123.79;20;2475.80
10783;2009;4;24-4-2009;1442.50;Hanari Carnes;Brazil;C�te de Blaye;Beverages;263.50;5;1317.50
10783;2009;4;24-4-2009;1442.50;Hanari Carnes;Brazil;Gorgonzola Telino;Dairy Products;12.50;10;125.00
10784;2009;4;24-4-2009;1650.00;Magazzini Alimentari Riuniti;Italy;Chartreuse verte;Beverages;18.00;2;36.00
10784;2009;4;24-4-2009;1650.00;Magazzini Alimentari Riuniti;Italy;Mozzarella di Giovanni;Dairy Products;34.80;30;1044.00
10784;2009;4;24-4-2009;1650.00;Magazzini Alimentari Riuniti;Italy;Inlagd Sill;Seafood;19.00;30;570.00
10785;2009;4;24-4-2009;387.50;GROSELLA-Restaurante;Venezuela;Rh�nbr�u Klosterbier;Beverages;7.75;10;77.50
10785;2009;4;24-4-2009;387.50;GROSELLA-Restaurante;Venezuela;Ikura;Seafood;31.00;10;310.00
10781;2009;4;23-4-2009;1132.35;Wartian Herkku;Finland;Gnocchi di nonna Alice;Grains/Cereals;38.00;20;760.00
10781;2009;4;23-4-2009;1132.35;Wartian Herkku;Finland;Tourti�re;Meat/Poultry;7.45;3;22.35
10781;2009;4;23-4-2009;1132.35;Wartian Herkku;Finland;Longlife Tofu;Produce;10.00;35;350.00
10782;2009;4;23-4-2009;12.50;Cactus Comidas para llevar;Argentina;Gorgonzola Telino;Dairy Products;12.50;1;12.50
10778;2009;4;22-4-2009;96.50;Berglunds snabbk�p;Sweden;Jack's New England Clam Chowder;Seafood;9.65;10;96.50
10779;2009;4;22-4-2009;1335.00;Morgenstern Gesundkost;Germany;Pavlova;Confections;17.45;20;349.00
10779;2009;4;22-4-2009;1335.00;Morgenstern Gesundkost;Germany;Tarte au sucre;Confections;49.30;20;986.00
10780;2009;4;22-4-2009;720.00;LILA-Supermercado;Venezuela;Outback Lager;Beverages;15.00;35;525.00
10780;2009;4;22-4-2009;720.00;LILA-Supermercado;Venezuela;Original Frankfurter gr�ne So�e;Condiments;13.00;15;195.00
10776;2009;4;21-4-2009;6984.50;Ernst Handel;Austria;Gorgonzola Telino;Dairy Products;12.50;16;200.00
10776;2009;4;21-4-2009;6984.50;Ernst Handel;Austria;Singaporean Hokkien Fried Mee;Grains/Cereals;14.00;12;168.00
10776;2009;4;21-4-2009;6984.50;Ernst Handel;Austria;Manjimup Dried Apples;Produce;53.00;120;6360.00
10776;2009;4;21-4-2009;6984.50;Ernst Handel;Austria;R�gede sild;Seafood;9.50;27;256.50
10777;2009;4;21-4-2009;280.00;Gourmet Lanchonetes;Brazil;Singaporean Hokkien Fried Mee;Grains/Cereals;14.00;20;280.00
10775;2009;4;18-4-2009;228.00;The Cracker Box;USA;Laughing Lumberjack Lager;Beverages;14.00;3;42.00
10775;2009;4;18-4-2009;228.00;The Cracker Box;USA;Ikura;Seafood;31.00;6;186.00
10773;2009;4;17-4-2009;2216.25;Ernst Handel;Austria;Rh�nbr�u Klosterbier;Beverages;7.75;7;54.25
10773;2009;4;17-4-2009;2216.25;Ernst Handel;Austria;Gorgonzola Telino;Dairy Products;12.50;70;875.00
10773;2009;4;17-4-2009;2216.25;Ernst Handel;Austria;Alice Mutton;Meat/Poultry;39.00;33;1287.00
10774;2009;4;17-4-2009;875.00;Folk och f� HB;Sweden;Louisiana Hot Spiced Okra;Condiments;17.00;50;850.00
10774;2009;4;17-4-2009;875.00;Folk och f� HB;Sweden;Gorgonzola Telino;Dairy Products;12.50;2;25.00
10771;2009;4;16-4-2009;344.00;Ernst Handel;Austria;Fl�temysost;Dairy Products;21.50;16;344.00
10772;2009;4;16-4-2009;3603.22;Lehmanns Marktstand;Germany;Raclette Courdavault;Dairy Products;55.00;25;1375.00
10772;2009;4;16-4-2009;3603.22;Lehmanns Marktstand;Germany;Th�ringer Rostbratwurst;Meat/Poultry;123.79;18;2228.22
10770;2009;4;15-4-2009;315.00;Hanari Carnes;Brazil;Queso Cabrales;Dairy Products;21.00;15;315.00
10768;2009;4;14-4-2009;1477.00;Around the Horn;UK;Gorgonzola Telino;Dairy Products;12.50;50;625.00
10768;2009;4;14-4-2009;1477.00;Around the Horn;UK;Camembert Pierrot;Dairy Products;34.00;15;510.00
10768;2009;4;14-4-2009;1477.00;Around the Horn;UK;Fl�temysost;Dairy Products;21.50;12;258.00
10768;2009;4;14-4-2009;1477.00;Around the Horn;UK;Gustaf's Kn�ckebr�d;Grains/Cereals;21.00;4;84.00
10769;2009;4;14-4-2009;1704.00;Vaffeljernet;Denmark;Sirop d'�rable;Condiments;28.50;20;570.00
10769;2009;4;14-4-2009;1704.00;Vaffeljernet;Denmark;Tarte au sucre;Confections;49.30;15;739.50
10769;2009;4;14-4-2009;1704.00;Vaffeljernet;Denmark;Filo Mix;Grains/Cereals;7.00;15;105.00
10769;2009;4;14-4-2009;1704.00;Vaffeljernet;Denmark;Jack's New England Clam Chowder;Seafood;9.65;30;289.50
10766;2009;4;11-4-2009;2310.00;Ottilies K�seladen;Germany;Chang;Beverages;19.00;40;760.00
10766;2009;4;11-4-2009;2310.00;Ottilies K�seladen;Germany;Scottish Longbreads;Confections;12.50;40;500.00
10766;2009;4;11-4-2009;2310.00;Ottilies K�seladen;Germany;Uncle Bob's Organic Dried Pears;Produce;30.00;35;1050.00
10767;2009;4;11-4-2009;28.00;Supr�mes d�lices;Belgium;Singaporean Hokkien Fried Mee;Grains/Cereals;14.00;2;28.00
10765;2009;4;10-4-2009;1684.00;QUICK-Stop;Germany;Louisiana Fiery Hot Pepper Sauce;Condiments;21.05;80;1684.00
10763;2009;4;9-4-2009;616.00;Folies gourmandes;France;Guaran� Fant�stica;Beverages;4.50;20;90.00
10763;2009;4;9-4-2009;616.00;Folies gourmandes;France;Sir Rodney's Scones;Confections;10.00;40;400.00
10763;2009;4;9-4-2009;616.00;Folies gourmandes;France;Gustaf's Kn�ckebr�d;Grains/Cereals;21.00;6;126.00
10764;2009;4;9-4-2009;2540.00;Ernst Handel;Austria;Chartreuse verte;Beverages;18.00;130;2340.00
10764;2009;4;9-4-2009;2540.00;Ernst Handel;Austria;Aniseed Syrup;Condiments;10.00;20;200.00
10761;2009;4;8-4-2009;629.50;Rattlesnake Canyon Grocery;USA;Rh�nbr�u Klosterbier;Beverages;7.75;18;139.50
10761;2009;4;8-4-2009;629.50;Rattlesnake Canyon Grocery;USA;NuNuCa Nu�-Nougat-Creme;Confections;14.00;35;490.00
10762;2009;4;8-4-2009;4337.00;Folk och f� HB;Sweden;Chartreuse verte;Beverages;18.00;16;288.00
10762;2009;4;8-4-2009;4337.00;Folk och f� HB;Sweden;Zaanse koeken;Confections;9.50;30;285.00
10762;2009;4;8-4-2009;4337.00;Folk och f� HB;Sweden;Gnocchi di nonna Alice;Grains/Cereals;38.00;60;2280.00
10762;2009;4;8-4-2009;4337.00;Folk och f� HB;Sweden;Manjimup Dried Apples;Produce;53.00;28;1484.00
10760;2009;4;7-4-2009;3304.00;Maison Dewey;Belgium;Ipoh Coffee;Beverages;46.00;30;1380.00
10760;2009;4;7-4-2009;3304.00;Maison Dewey;Belgium;NuNuCa Nu�-Nougat-Creme;Confections;14.00;12;168.00
10760;2009;4;7-4-2009;3304.00;Maison Dewey;Belgium;Schoggi Schokolade;Confections;43.90;40;1756.00
10758;2009;4;4-4-2009;1644.60;Richter Supermarkt;Switzerland;Outback Lager;Beverages;15.00;40;600.00
10758;2009;4;4-4-2009;1644.60;Richter Supermarkt;Switzerland;Gumb�r Gummib�rchen;Confections;31.23;20;624.60
10758;2009;4;4-4-2009;1644.60;Richter Supermarkt;Switzerland;Filo Mix;Grains/Cereals;7.00;60;420.00
10759;2009;4;4-4-2009;320.00;Ana Trujillo Emparedados y helados;Mexico;Mascarpone Fabioli;Dairy Products;32.00;10;320.00
10756;2009;4;3-4-2009;2487.50;Split Rail Beer & Ale;USA;Scottish Longbreads;Confections;12.50;6;75.00
10756;2009;4;3-4-2009;2487.50;Split Rail Beer & Ale;USA;Gudbrandsdalsost;Dairy Products;36.00;20;720.00
10756;2009;4;3-4-2009;2487.50;Split Rail Beer & Ale;USA;Carnarvon Tigers;Seafood;62.50;21;1312.50
10756;2009;4;3-4-2009;2487.50;Split Rail Beer & Ale;USA;Inlagd Sill;Seafood;19.00;20;380.00
10757;2009;4;3-4-2009;3082.00;Save-a-lot Markets;USA;Sasquatch Ale;Beverages;14.00;30;420.00
10757;2009;4;3-4-2009;3082.00;Save-a-lot Markets;USA;Tarte au sucre;Confections;49.30;30;1479.00
10757;2009;4;3-4-2009;3082.00;Save-a-lot Markets;USA;Raclette Courdavault;Dairy Products;55.00;7;385.00
10757;2009;4;3-4-2009;3082.00;Save-a-lot Markets;USA;Wimmers gute Semmelkn�del;Grains/Cereals;33.25;24;798.00
10755;2009;4;2-4-2009;2598.00;Bon app';France;Zaanse koeken;Confections;9.50;30;285.00
10755;2009;4;2-4-2009;2598.00;Bon app';France;Gudbrandsdalsost;Dairy Products;36.00;25;900.00
10755;2009;4;2-4-2009;2598.00;Bon app';France;Gnocchi di nonna Alice;Grains/Cereals;38.00;30;1140.00
10755;2009;4;2-4-2009;2598.00;Bon app';France;Ravioli Angelo;Grains/Cereals;19.50;14;273.00
10753;2009;4;1-4-2009;88.00;Franchi SpA;Italy;Longlife Tofu;Produce;10.00;5;50.00
10753;2009;4;1-4-2009;88.00;Franchi SpA;Italy;R�gede sild;Seafood;9.50;4;38.00
10754;2009;4;1-4-2009;55.20;Magazzini Alimentari Riuniti;Italy;Boston Crab Meat;Seafood;18.40;3;55.20
10751;2009;3;31-3-2009;1701.46;Richter Supermarkt;Switzerland;Gumb�r Gummib�rchen;Confections;31.23;12;374.76
10751;2009;3;31-3-2009;1701.46;Richter Supermarkt;Switzerland;Valkoinen suklaa;Confections;16.25;20;325.00
10751;2009;3;31-3-2009;1701.46;Richter Supermarkt;Switzerland;Nord-Ost Matjeshering;Seafood;25.89;30;776.70
10751;2009;3;31-3-2009;1701.46;Richter Supermarkt;Switzerland;R�d Kaviar;Seafood;15.00;15;225.00
10752;2009;3;31-3-2009;252.00;North/South;UK;Chai;Beverages;18.00;8;144.00
10752;2009;3;31-3-2009;252.00;North/South;UK;Gudbrandsdalsost;Dairy Products;36.00;3;108.00
10750;2009;3;28-3-2009;1871.25;Wartian Herkku;Finland;Raclette Courdavault;Dairy Products;55.00;25;1375.00
10750;2009;3;28-3-2009;1871.25;Wartian Herkku;Finland;Tofu;Produce;23.25;5;116.25
10750;2009;3;28-3-2009;1871.25;Wartian Herkku;Finland;R�gede sild;Seafood;9.50;40;380.00
10748;2009;3;27-3-2009;2196.00;Save-a-lot Markets;USA;Tunnbr�d;Grains/Cereals;9.00;44;396.00
10748;2009;3;27-3-2009;2196.00;Save-a-lot Markets;USA;Gnocchi di nonna Alice;Grains/Cereals;38.00;28;1064.00
10748;2009;3;27-3-2009;2196.00;Save-a-lot Markets;USA;Boston Crab Meat;Seafood;18.40;40;736.00
10749;2009;3;27-3-2009;1080.00;Island Trading;UK;Lakkalik��ri;Beverages;18.00;10;180.00
10749;2009;3;27-3-2009;1080.00;Island Trading;UK;Raclette Courdavault;Dairy Products;55.00;6;330.00
10749;2009;3;27-3-2009;1080.00;Island Trading;UK;Gnocchi di nonna Alice;Grains/Cereals;38.00;15;570.00
10746;2009;3;26-3-2009;2311.70;Chop-suey Chinese;Switzerland;Tarte au sucre;Confections;49.30;9;443.70
10746;2009;3;26-3-2009;2311.70;Chop-suey Chinese;Switzerland;Gudbrandsdalsost;Dairy Products;36.00;40;1440.00
10746;2009;3;26-3-2009;2311.70;Chop-suey Chinese;Switzerland;Singaporean Hokkien Fried Mee;Grains/Cereals;14.00;28;392.00
10746;2009;3;26-3-2009;2311.70;Chop-suey Chinese;Switzerland;Konbu;Seafood;6.00;6;36.00
10747;2009;3;26-3-2009;1912.85;Piccolo und mehr;Austria;Vegie-spread;Condiments;43.90;9;395.10
10747;2009;3;26-3-2009;1912.85;Piccolo und mehr;Austria;Gorgonzola Telino;Dairy Products;12.50;8;100.00
10747;2009;3;26-3-2009;1912.85;Piccolo und mehr;Austria;Gudbrandsdalsost;Dairy Products;36.00;30;1080.00
10747;2009;3;26-3-2009;1912.85;Piccolo und mehr;Austria;Jack's New England Clam Chowder;Seafood;9.65;35;337.75
10745;2009;3;25-3-2009;4529.80;QUICK-Stop;Germany;Gula Malacca;Condiments;19.45;16;311.20
10745;2009;3;25-3-2009;4529.80;QUICK-Stop;Germany;Raclette Courdavault;Dairy Products;55.00;45;2475.00
10745;2009;3;25-3-2009;4529.80;QUICK-Stop;Germany;Mozzarella di Giovanni;Dairy Products;34.80;7;243.60
10745;2009;3;25-3-2009;4529.80;QUICK-Stop;Germany;Carnarvon Tigers;Seafood;62.50;24;1500.00
10743;2009;3;24-3-2009;336.00;Around the Horn;UK;Spegesild;Seafood;12.00;28;336.00
10744;2009;3;24-3-2009;920.00;Vaffeljernet;Denmark;Boston Crab Meat;Seafood;18.40;50;920.00
10741;2009;3;21-3-2009;285.00;Around the Horn;UK;Chang;Beverages;19.00;15;285.00
10742;2009;3;21-3-2009;3118.00;Bottom-Dollar Markets;Canada;Aniseed Syrup;Condiments;10.00;20;200.00
10742;2009;3;21-3-2009;3118.00;Bottom-Dollar Markets;Canada;Camembert Pierrot;Dairy Products;34.00;50;1700.00
10742;2009;3;21-3-2009;3118.00;Bottom-Dollar Markets;Canada;Mozzarella di Giovanni;Dairy Products;34.80;35;1218.00
10740;2009;3;20-3-2009;1770.00;White Clover Markets;USA;Steeleye Stout;Beverages;18.00;35;630.00
10740;2009;3;20-3-2009;1770.00;White Clover Markets;USA;Gnocchi di nonna Alice;Grains/Cereals;38.00;14;532.00
10740;2009;3;20-3-2009;1770.00;White Clover Markets;USA;R�ssle Sauerkraut;Produce;45.60;5;228.00
10740;2009;3;20-3-2009;1770.00;White Clover Markets;USA;R�gede sild;Seafood;9.50;40;380.00
10738;2009;3;19-3-2009;52.35;Sp�cialit�s du monde;France;Pavlova;Confections;17.45;3;52.35
10739;2009;3;19-3-2009;240.00;Vins et alcools Chevalier;France;Filo Mix;Grains/Cereals;7.00;18;126.00
10739;2009;3;19-3-2009;240.00;Vins et alcools Chevalier;France;Inlagd Sill;Seafood;19.00;6;114.00
10736;2009;3;18-3-2009;997.00;Hungry Owl All-Night Grocers;Ireland;Rh�nbr�u Klosterbier;Beverages;7.75;20;155.00
10736;2009;3;18-3-2009;997.00;Hungry Owl All-Night Grocers;Ireland;Louisiana Fiery Hot Pepper Sauce;Condiments;21.05;40;842.00
10737;2009;3;18-3-2009;139.80;Vins et alcools Chevalier;France;Konbu;Seafood;6.00;4;24.00
10737;2009;3;18-3-2009;139.80;Vins et alcools Chevalier;France;Jack's New England Clam Chowder;Seafood;9.65;12;115.80
10735;2009;3;17-3-2009;596.00;Let's Stop N Shop;USA;Sirop d'�rable;Condiments;28.50;20;570.00
10735;2009;3;17-3-2009;596.00;Let's Stop N Shop;USA;Original Frankfurter gr�ne So�e;Condiments;13.00;2;26.00
10733;2009;3;14-3-2009;1459.00;Berglunds snabbk�p;Sweden;Filo Mix;Grains/Cereals;7.00;25;175.00
10733;2009;3;14-3-2009;1459.00;Berglunds snabbk�p;Sweden;Tofu;Produce;23.25;16;372.00
10733;2009;3;14-3-2009;1459.00;Berglunds snabbk�p;Sweden;R�ssle Sauerkraut;Produce;45.60;20;912.00
10734;2009;3;14-3-2009;1498.35;Gourmet Lanchonetes;Brazil;Lakkalik��ri;Beverages;18.00;20;360.00
10734;2009;3;14-3-2009;1498.35;Gourmet Lanchonetes;Brazil;Grandma's Boysenberry Spread;Condiments;25.00;30;750.00
10734;2009;3;14-3-2009;1498.35;Gourmet Lanchonetes;Brazil;Nord-Ost Matjeshering;Seafood;25.89;15;388.35
10731;2009;3;13-3-2009;1990.00;Chop-suey Chinese;Switzerland;Sir Rodney's Scones;Confections;10.00;40;400.00
10731;2009;3;13-3-2009;1990.00;Chop-suey Chinese;Switzerland;Manjimup Dried Apples;Produce;53.00;30;1590.00
10732;2009;3;13-3-2009;360.00;Bon app';France;Lakkalik��ri;Beverages;18.00;20;360.00
10730;2009;3;12-3-2009;509.75;Bon app';France;Louisiana Fiery Hot Pepper Sauce;Condiments;21.05;10;210.50
10730;2009;3;12-3-2009;509.75;Bon app';France;Pavlova;Confections;17.45;15;261.75
10730;2009;3;12-3-2009;509.75;Bon app';France;Gorgonzola Telino;Dairy Products;12.50;3;37.50
10728;2009;3;11-3-2009;1296.75;Queen Cozinha;Brazil;Camembert Pierrot;Dairy Products;34.00;15;510.00
10728;2009;3;11-3-2009;1296.75;Queen Cozinha;Brazil;P�t� chinois;Meat/Poultry;24.00;12;288.00
10728;2009;3;11-3-2009;1296.75;Queen Cozinha;Brazil;Nord-Ost Matjeshering;Seafood;25.89;15;388.35
10728;2009;3;11-3-2009;1296.75;Queen Cozinha;Brazil;Boston Crab Meat;Seafood;18.40;6;110.40
10729;2009;3;11-3-2009;1850.00;LINO-Delicateses;Venezuela;Chai;Beverages;18.00;50;900.00
10729;2009;3;11-3-2009;1850.00;LINO-Delicateses;Venezuela;Sir Rodney's Scones;Confections;10.00;30;300.00
10729;2009;3;11-3-2009;1850.00;LINO-Delicateses;Venezuela;Valkoinen suklaa;Confections;16.25;40;650.00
10726;2009;3;10-3-2009;655.00;Eastern Connection;UK;Chef Anton's Cajun Seasoning;Condiments;22.00;25;550.00
10726;2009;3;10-3-2009;655.00;Eastern Connection;UK;Queso Cabrales;Dairy Products;21.00;5;105.00
10727;2009;3;10-3-2009;1710.00;Reggiani Caseifici;Italy;Raclette Courdavault;Dairy Products;55.00;10;550.00
10727;2009;3;10-3-2009;1710.00;Reggiani Caseifici;Italy;Gnocchi di nonna Alice;Grains/Cereals;38.00;10;380.00
10727;2009;3;10-3-2009;1710.00;Reggiani Caseifici;Italy;Alice Mutton;Meat/Poultry;39.00;20;780.00
10725;2009;3;7-3-2009;287.80;Familia Arquibaldo;Brazil;Filo Mix;Grains/Cereals;7.00;4;28.00
10725;2009;3;7-3-2009;287.80;Familia Arquibaldo;Brazil;P�t� chinois;Meat/Poultry;24.00;6;144.00
10725;2009;3;7-3-2009;287.80;Familia Arquibaldo;Brazil;Jack's New England Clam Chowder;Seafood;9.65;12;115.80
10723;2009;3;6-3-2009;468.45;White Clover Markets;USA;Gumb�r Gummib�rchen;Confections;31.23;15;468.45
10724;2009;3;6-3-2009;638.50;M�re Paillarde;Canada;Sirop d'�rable;Condiments;28.50;5;142.50
10724;2009;3;6-3-2009;638.50;M�re Paillarde;Canada;Ikura;Seafood;31.00;16;496.00
10721;2009;3;5-3-2009;972.50;QUICK-Stop;Germany;Gula Malacca;Condiments;19.45;50;972.50
10722;2009;3;5-3-2009;1570.00;Save-a-lot Markets;USA;Chang;Beverages;19.00;3;57.00
10722;2009;3;5-3-2009;1570.00;Save-a-lot Markets;USA;Rh�nbr�u Klosterbier;Beverages;7.75;42;325.50
10722;2009;3;5-3-2009;1570.00;Save-a-lot Markets;USA;Scottish Longbreads;Confections;12.50;45;562.50
10722;2009;3;5-3-2009;1570.00;Save-a-lot Markets;USA;Gorgonzola Telino;Dairy Products;12.50;50;625.00
10720;2009;3;4-3-2009;550.00;Que Del�cia;Brazil;Steeleye Stout;Beverages;18.00;21;378.00
10720;2009;3;4-3-2009;550.00;Que Del�cia;Brazil;Fl�temysost;Dairy Products;21.50;8;172.00
10718;2009;3;3-3-2009;3463.00;K�niglich Essen;Germany;Pavlova;Confections;17.45;20;349.00
10718;2009;3;3-3-2009;3463.00;K�niglich Essen;Germany;Tarte au sucre;Confections;49.30;20;986.00
10718;2009;3;3-3-2009;3463.00;K�niglich Essen;Germany;Queso Manchego La Pastora;Dairy Products;38.00;36;1368.00
10718;2009;3;3-3-2009;3463.00;K�niglich Essen;Germany;Inlagd Sill;Seafood;19.00;40;760.00
10719;2009;3;3-3-2009;1125.67;Let's Stop N Shop;USA;Tourti�re;Meat/Poultry;7.45;40;298.00
10719;2009;3;3-3-2009;1125.67;Let's Stop N Shop;USA;Carnarvon Tigers;Seafood;62.50;12;750.00
10719;2009;3;3-3-2009;1125.67;Let's Stop N Shop;USA;Nord-Ost Matjeshering;Seafood;25.89;3;77.67
10716;2009;2;28-2-2009;706.00;Rancho grande;Argentina;Sirop d'�rable;Condiments;28.50;10;285.00
10716;2009;2;28-2-2009;706.00;Rancho grande;Argentina;Sir Rodney's Scones;Confections;10.00;5;50.00
10716;2009;2;28-2-2009;706.00;Rancho grande;Argentina;Manjimup Dried Apples;Produce;53.00;7;371.00
10717;2009;2;28-2-2009;1331.75;Frankenversand;Germany;Sir Rodney's Scones;Confections;10.00;32;320.00
10717;2009;2;28-2-2009;1331.75;Frankenversand;Germany;Gudbrandsdalsost;Dairy Products;36.00;25;900.00
10717;2009;2;28-2-2009;1331.75;Frankenversand;Germany;Tourti�re;Meat/Poultry;7.45;15;111.75
10715;2009;2;27-2-2009;1296.00;Bon app';France;Fl�temysost;Dairy Products;21.50;30;645.00
10715;2009;2;27-2-2009;1296.00;Bon app';France;Ikura;Seafood;31.00;21;651.00
10713;2009;2;26-2-2009;2827.90;Save-a-lot Markets;USA;Gumb�r Gummib�rchen;Confections;31.23;30;936.90
10713;2009;2;26-2-2009;2827.90;Save-a-lot Markets;USA;Ikura;Seafood;31.00;18;558.00
10713;2009;2;26-2-2009;2827.90;Save-a-lot Markets;USA;R�gede sild;Seafood;9.50;110;1045.00
10713;2009;2;26-2-2009;2827.90;Save-a-lot Markets;USA;Spegesild;Seafood;12.00;24;288.00
10714;2009;2;26-2-2009;2941.00;Save-a-lot Markets;USA;Chang;Beverages;19.00;30;570.00
10714;2009;2;26-2-2009;2941.00;Save-a-lot Markets;USA;Zaanse koeken;Confections;9.50;50;475.00
10714;2009;2;26-2-2009;2941.00;Save-a-lot Markets;USA;Gnocchi di nonna Alice;Grains/Cereals;38.00;18;684.00
10714;2009;2;26-2-2009;2941.00;Save-a-lot Markets;USA;Alice Mutton;Meat/Poultry;39.00;27;1053.00
10714;2009;2;26-2-2009;2941.00;Save-a-lot Markets;USA;Escargots de Bourgogne;Seafood;13.25;12;159.00
10711;2009;2;25-2-2009;4451.70;Save-a-lot Markets;USA;Teatime Chocolate Biscuits;Confections;9.20;12;110.40
10711;2009;2;25-2-2009;4451.70;Save-a-lot Markets;USA;Perth Pasties;Meat/Poultry;32.80;120;3936.00
10711;2009;2;25-2-2009;4451.70;Save-a-lot Markets;USA;Jack's New England Clam Chowder;Seafood;9.65;42;405.30
10712;2009;2;25-2-2009;1238.40;Hungry Owl All-Night Grocers;Ireland;Gnocchi di nonna Alice;Grains/Cereals;38.00;30;1140.00
10712;2009;2;25-2-2009;1238.40;Hungry Owl All-Night Grocers;Ireland;Perth Pasties;Meat/Poultry;32.80;3;98.40
10710;2009;2;24-2-2009;93.50;Franchi SpA;Italy;Teatime Chocolate Biscuits;Confections;9.20;5;46.00
10710;2009;2;24-2-2009;93.50;Franchi SpA;Italy;Zaanse koeken;Confections;9.50;5;47.50
10708;2009;2;21-2-2009;180.40;The Big Cheese;USA;Chef Anton's Gumbo Mix;Condiments;21.35;4;85.40
10708;2009;2;21-2-2009;180.40;The Big Cheese;USA;Inlagd Sill;Seafood;19.00;5;95.00
10709;2009;2;21-2-2009;3424.00;Gourmet Lanchonetes;Brazil;Northwoods Cranberry Sauce;Condiments;40.00;40;1600.00
10709;2009;2;21-2-2009;3424.00;Gourmet Lanchonetes;Brazil;Camembert Pierrot;Dairy Products;34.00;10;340.00
10709;2009;2;21-2-2009;3424.00;Gourmet Lanchonetes;Brazil;Manjimup Dried Apples;Produce;53.00;28;1484.00
10706;2009;2;20-2-2009;1893.00;Old World Delicatessen;USA;Ipoh Coffee;Beverages;46.00;24;1104.00
10706;2009;2;20-2-2009;1893.00;Old World Delicatessen;USA;Pavlova;Confections;17.45;20;349.00
10706;2009;2;20-2-2009;1893.00;Old World Delicatessen;USA;Raclette Courdavault;Dairy Products;55.00;8;440.00
10707;2009;2;20-2-2009;1704.00;Around the Horn;UK;Outback Lager;Beverages;15.00;28;420.00
10707;2009;2;20-2-2009;1704.00;Around the Horn;UK;Ravioli Angelo;Grains/Cereals;19.50;40;780.00
10707;2009;2;20-2-2009;1704.00;Around the Horn;UK;P�t� chinois;Meat/Poultry;24.00;21;504.00
10705;2009;2;19-2-2009;378.00;HILARI�N-Abastos;Venezuela;Gorgonzola Telino;Dairy Products;12.50;20;250.00
10705;2009;2;19-2-2009;378.00;HILARI�N-Abastos;Venezuela;Mascarpone Fabioli;Dairy Products;32.00;4;128.00
10703;2009;2;18-2-2009;2545.00;Folk och f� HB;Sweden;Chang;Beverages;19.00;5;95.00
10703;2009;2;18-2-2009;2545.00;Folk och f� HB;Sweden;Raclette Courdavault;Dairy Products;55.00;35;1925.00
10703;2009;2;18-2-2009;2545.00;Folk och f� HB;Sweden;R�d Kaviar;Seafood;15.00;35;525.00
10704;2009;2;18-2-2009;595.50;Queen Cozinha;Brazil;Guaran� Fant�stica;Beverages;4.50;35;157.50
10704;2009;2;18-2-2009;595.50;Queen Cozinha;Brazil;Chef Anton's Cajun Seasoning;Condiments;22.00;6;132.00
10704;2009;2;18-2-2009;595.50;Queen Cozinha;Brazil;Chocolade;Confections;12.75;24;306.00
10701;2009;2;17-2-2009;3370.00;Hungry Owl All-Night Grocers;Ireland;Lakkalik��ri;Beverages;18.00;35;630.00
10701;2009;2;17-2-2009;3370.00;Hungry Owl All-Night Grocers;Ireland;Raclette Courdavault;Dairy Products;55.00;42;2310.00
10701;2009;2;17-2-2009;3370.00;Hungry Owl All-Night Grocers;Ireland;Fl�temysost;Dairy Products;21.50;20;430.00
10702;2009;2;17-2-2009;330.00;Alfreds Futterkiste;Germany;Lakkalik��ri;Beverages;18.00;15;270.00
10702;2009;2;17-2-2009;330.00;Alfreds Futterkiste;Germany;Aniseed Syrup;Condiments;10.00;6;60.00
10700;2009;2;14-2-2009;2048.00;Save-a-lot Markets;USA;Chai;Beverages;18.00;5;90.00
10700;2009;2;14-2-2009;2048.00;Save-a-lot Markets;USA;Sasquatch Ale;Beverages;14.00;12;168.00
10700;2009;2;14-2-2009;2048.00;Save-a-lot Markets;USA;Scottish Longbreads;Confections;12.50;40;500.00
10700;2009;2;14-2-2009;2048.00;Save-a-lot Markets;USA;Fl�temysost;Dairy Products;21.50;60;1290.00
10698;2009;2;13-2-2009;3600.73;Ernst Handel;Austria;Outback Lager;Beverages;15.00;8;120.00
10698;2009;2;13-2-2009;3600.73;Ernst Handel;Austria;Louisiana Fiery Hot Pepper Sauce;Condiments;21.05;65;1368.25
10698;2009;2;13-2-2009;3600.73;Ernst Handel;Austria;Queso Cabrales;Dairy Products;21.00;15;315.00
10698;2009;2;13-2-2009;3600.73;Ernst Handel;Austria;Alice Mutton;Meat/Poultry;39.00;8;312.00
10698;2009;2;13-2-2009;3600.73;Ernst Handel;Austria;Th�ringer Rostbratwurst;Meat/Poultry;123.79;12;1485.48
10699;2009;2;13-2-2009;114.00;Morgenstern Gesundkost;Germany;Zaanse koeken;Confections;9.50;12;114.00
10696;2009;2;12-2-2009;996.00;White Clover Markets;USA;Alice Mutton;Meat/Poultry;39.00;20;780.00
10696;2009;2;12-2-2009;996.00;White Clover Markets;USA;Spegesild;Seafood;12.00;18;216.00
10697;2009;2;12-2-2009;1073.90;LINO-Delicateses;Venezuela;Steeleye Stout;Beverages;18.00;9;162.00
10697;2009;2;12-2-2009;1073.90;LINO-Delicateses;Venezuela;Outback Lager;Beverages;15.00;30;450.00
10697;2009;2;12-2-2009;1073.90;LINO-Delicateses;Venezuela;Teatime Chocolate Biscuits;Confections;9.20;7;64.40
10697;2009;2;12-2-2009;1073.90;LINO-Delicateses;Venezuela;Escargots de Bourgogne;Seafood;13.25;30;397.50
10695;2009;2;11-2-2009;642.00;Wilman Kala;Finland;Guaran� Fant�stica;Beverages;4.50;20;90.00
10695;2009;2;11-2-2009;642.00;Wilman Kala;Finland;Northwoods Cranberry Sauce;Condiments;40.00;10;400.00
10695;2009;2;11-2-2009;642.00;Wilman Kala;Finland;Queso Manchego La Pastora;Dairy Products;38.00;4;152.00
10693;2009;2;10-2-2009;2334.00;White Clover Markets;USA;Gudbrandsdalsost;Dairy Products;36.00;30;1080.00
10693;2009;2;10-2-2009;2334.00;White Clover Markets;USA;Mishi Kobe Niku;Meat/Poultry;97.00;6;582.00
10693;2009;2;10-2-2009;2334.00;White Clover Markets;USA;Tourti�re;Meat/Poultry;7.45;60;447.00
10693;2009;2;10-2-2009;2334.00;White Clover Markets;USA;R�d Kaviar;Seafood;15.00;15;225.00
10694;2009;2;10-2-2009;4825.00;QUICK-Stop;Germany;Outback Lager;Beverages;15.00;50;750.00
10694;2009;2;10-2-2009;4825.00;QUICK-Stop;Germany;Raclette Courdavault;Dairy Products;55.00;25;1375.00
10694;2009;2;10-2-2009;4825.00;QUICK-Stop;Germany;Uncle Bob's Organic Dried Pears;Produce;30.00;90;2700.00
10691;2009;2;7-2-2009;10164.80;QUICK-Stop;Germany;Chai;Beverages;18.00;30;540.00
10691;2009;2;7-2-2009;10164.80;QUICK-Stop;Germany;Ipoh Coffee;Beverages;46.00;40;1840.00
10691;2009;2;7-2-2009;10164.80;QUICK-Stop;Germany;Gula Malacca;Condiments;19.45;24;466.80
10691;2009;2;7-2-2009;10164.80;QUICK-Stop;Germany;Tarte au sucre;Confections;49.30;48;2366.40
10691;2009;2;7-2-2009;10164.80;QUICK-Stop;Germany;Th�ringer Rostbratwurst;Meat/Poultry;123.79;40;4951.60
10692;2009;2;7-2-2009;878.00;Alfreds Futterkiste;Germany;Vegie-spread;Condiments;43.90;20;878.00
10690;2009;2;6-2-2009;1150.00;Hanari Carnes;Brazil;Original Frankfurter gr�ne So�e;Condiments;13.00;30;390.00
10690;2009;2;6-2-2009;1150.00;Hanari Carnes;Brazil;Gnocchi di nonna Alice;Grains/Cereals;38.00;20;760.00
10688;2009;2;5-2-2009;3490.00;Vaffeljernet;Denmark;Sasquatch Ale;Beverages;14.00;14;196.00
10688;2009;2;5-2-2009;3490.00;Vaffeljernet;Denmark;R�ssle Sauerkraut;Produce;45.60;60;2736.00
10688;2009;2;5-2-2009;3490.00;Vaffeljernet;Denmark;Ikura;Seafood;31.00;18;558.00
10689;2009;2;5-2-2009;630.00;Berglunds snabbk�p;Sweden;Chai;Beverages;18.00;35;630.00
